,PMID,Title,Authors,Citation,First Author,Journal/Book,Publication Year,Create Date,PMCID,NIHMS ID,DOI
2437,21738405,"Comparison of cell proliferation, protein, and glucose metabolism in musculoskeletal tumors in a PET study","Tian M, Zhang H, Endo K.",J Biomed Biotechnol. 2011;2011:807929. doi: 10.1155/2011/807929. Epub 2011 Jun 16.,Tian M,J Biomed Biotechnol,2011,2011/07/09,PMC3119418,,10.1155/2011/807929
2438,30468365,Are We Adhering To Paediatric DKA Guidelines?,"Powell A, Carroll A, Mc Donnell CM, Murphy NP.",Ir Med J. 2018 Apr 19;111(4):745.,Powell A,Ir Med J,2018,2018/11/24,,,
2439,22050535,Which obese youth are at increased risk for type 2 diabetes? Latent class analysis and comparison with diabetic youth,"Greig F, Hyman S, Wallach E, Hildebrandt T, Rapaport R.",Pediatr Diabetes. 2012 Mar;13(2):181-8. doi: 10.1111/j.1399-5448.2011.00792.x. Epub 2011 Nov 3.,Greig F,Pediatr Diabetes,2012,2011/11/05,,,10.1111/j.1399-5448.2011.00792.x
2440,26474213,The Biochemistry and Physiology of Mitochondrial Fatty Acid β-Oxidation and Its Genetic Disorders,"Houten SM, Violante S, Ventura FV, Wanders RJ.",Annu Rev Physiol. 2016;78:23-44. doi: 10.1146/annurev-physiol-021115-105045. Epub 2015 Oct 14.,Houten SM,Annu Rev Physiol,2016,2015/10/17,,,10.1146/annurev-physiol-021115-105045
2441,33328537,Maternal diet alters human milk oligosaccharide composition with implications for the milk metagenome,"Seferovic MD, Mohammad M, Pace RM, Engevik M, Versalovic J, Bode L, Haymond M, Aagaard KM.",Sci Rep. 2020 Dec 16;10(1):22092. doi: 10.1038/s41598-020-79022-6.,Seferovic MD,Sci Rep,2020,2020/12/17,PMC7745035,,10.1038/s41598-020-79022-6
2442,21969284,Hyperosmolar dextrose injection for recalcitrant Osgood-Schlatter disease,"Topol GA, Podesta LA, Reeves KD, Raya MF, Fullerton BD, Yeh HW.",Pediatrics. 2011 Nov;128(5):e1121-8. doi: 10.1542/peds.2010-1931. Epub 2011 Oct 3.,Topol GA,Pediatrics,2011,2011/10/05,,,10.1542/peds.2010-1931
2443,31415402,Nutrition management of congenital glucose-galactose malabsorption: Case report of a Chinese infant,"Ma M, Long Q, Chen F, Zhang T, Lu M, Wang W, Chen L.",Medicine (Baltimore). 2019 Aug;98(33):e16828. doi: 10.1097/MD.0000000000016828.,Ma M,Medicine (Baltimore),2019,2019/08/16,PMC6831416,,10.1097/MD.0000000000016828
2444,37188052,Editorial: Cross-talk between heterogeneous cell types in skeletal muscle: implications for glucose metabolism,"Caballero-Sánchez N, Winn N, Neto JCR, Nagy L.",Front Endocrinol (Lausanne). 2023 Apr 28;14:1185725. doi: 10.3389/fendo.2023.1185725. eCollection 2023.,Caballero-Sánchez N,Front Endocrinol (Lausanne),2023,2023/05/15,PMC10176605,,10.3389/fendo.2023.1185725
2445,28017785,Hepatic lipid metabolism and non-alcoholic fatty liver disease in aging,"Gong Z, Tas E, Yakar S, Muzumdar R.",Mol Cell Endocrinol. 2017 Nov 5;455:115-130. doi: 10.1016/j.mce.2016.12.022. Epub 2016 Dec 23.,Gong Z,Mol Cell Endocrinol,2017,2016/12/27,,,10.1016/j.mce.2016.12.022
2446,31967084,Burden of typhoid fever and cholera: similarities and differences. Prevention strategies for European travelers to endemic/epidemic areas,"Amicizia D, Micale RT, Pennati BM, Zangrillo F, Iovine M, Lecini E, Marchini F, Lai PL, Panatto D.",J Prev Med Hyg. 2019 Dec 20;60(4):E271-E285. doi: 10.15167/2421-4248/jpmh2019.60.4.1333. eCollection 2019 Dec.,Amicizia D,J Prev Med Hyg,2019,2020/01/23,PMC6953460,,10.15167/2421-4248/jpmh2019.60.4.1333
2447,17932566,Mechanism of age-dependent susceptibility and novel treatment strategy in glutaric acidemia type I,"Zinnanti WJ, Lazovic J, Housman C, LaNoue K, O'Callaghan JP, Simpson I, Woontner M, Goodman SI, Connor JR, Jacobs RE, Cheng KC.",J Clin Invest. 2007 Nov;117(11):3258-70. doi: 10.1172/JCI31617.,Zinnanti WJ,J Clin Invest,2007,2007/10/13,PMC2000809,,10.1172/JCI31617
2448,37513580,Fructose Metabolism and Metabolic Dysfunction in Adolescents and Young Adults,"Softic S, Lanaspa MA, DeBosch B.",Nutrients. 2023 Jul 16;15(14):3162. doi: 10.3390/nu15143162.,Softic S,Nutrients,2023,2023/07/29,PMC10383708,,10.3390/nu15143162
2449,37474753,Quality improvement initiative to impact Golden Hour timeliness using a dedicated delivery team,"Welch B, Stanton Tully J, Horan J, Thomas A, Lien I, Barbato A.",J Perinatol. 2024 Mar;44(3):452-457. doi: 10.1038/s41372-023-01731-3. Epub 2023 Jul 20.,Welch B,J Perinatol,2024,2023/07/20,,,10.1038/s41372-023-01731-3
2450,36289225,Functional and metabolic alterations of gut microbiota in children with new-onset type 1 diabetes,"Yuan X, Wang R, Han B, Sun C, Chen R, Wei H, Chen L, Du H, Li G, Yang Y, Chen X, Cui L, Xu Z, Fu J, Wu J, Gu W, Chen Z, Fang X, Yang H, Su Z, Wu J, Li Q, Zhang M, Zhou Y, Zhang L, Ji G, Luo F.",Nat Commun. 2022 Oct 26;13(1):6356. doi: 10.1038/s41467-022-33656-4.,Yuan X,Nat Commun,2022,2022/10/26,PMC9606127,,10.1038/s41467-022-33656-4
2451,29969188,DEPTOR modulates activation responses in CD4(+) T cells and enhances immunoregulation following transplantation,"Wedel J, Bruneau S, Liu K, Kong SW, Sage PT, Sabatini DM, Laplante M, Briscoe DM.",Am J Transplant. 2019 Jan;19(1):77-88. doi: 10.1111/ajt.14995. Epub 2018 Aug 17.,Wedel J,Am J Transplant,2019,2018/07/04,PMC6310634,NIHMS979297,10.1111/ajt.14995
2452,26817591,"Fructose-Rich Beverage Intake and Central Adiposity, Uric Acid, and Pediatric Insulin Resistance","Lin WT, Chan TF, Huang HL, Lee CY, Tsai S, Wu PW, Yang YC, Wang TN, Lee CH.",J Pediatr. 2016 Apr;171:90-6.e1. doi: 10.1016/j.jpeds.2015.12.061. Epub 2016 Jan 23.,Lin WT,J Pediatr,2016,2016/01/29,,,10.1016/j.jpeds.2015.12.061
2453,7844662,Effects of acute hyperglycemia on mental efficiency and counterregulatory hormones in adolescents with insulin-dependent diabetes mellitus,"Gschwend S, Ryan C, Atchison J, Arslanian S, Becker D.",J Pediatr. 1995 Feb;126(2):178-84. doi: 10.1016/s0022-3476(95)70542-2.,Gschwend S,J Pediatr,1995,1995/02/01,,,10.1016/s0022-3476(95)70542-2
2454,28416194,"Foxp3 Reprograms T Cell Metabolism to Function in Low-Glucose, High-Lactate Environments","Angelin A, Gil-de-Gómez L, Dahiya S, Jiao J, Guo L, Levine MH, Wang Z, Quinn WJ 3rd, Kopinski PK, Wang L, Akimova T, Liu Y, Bhatti TR, Han R, Laskin BL, Baur JA, Blair IA, Wallace DC, Hancock WW, Beier UH.",Cell Metab. 2017 Jun 6;25(6):1282-1293.e7. doi: 10.1016/j.cmet.2016.12.018. Epub 2017 Apr 13.,Angelin A,Cell Metab,2017,2017/04/19,PMC5462872,NIHMS839915,10.1016/j.cmet.2016.12.018
2455,29448828,Role of terminal warm blood cardioplegia in complex congenital heart surgery,"Busro PW, Romolo H, Sastroasmoro S, Rachmat J, Sadikin M, Santoso A, Boom CE, Suwarto S, Jusuf AA.",Asian Cardiovasc Thorac Ann. 2018 Mar;26(3):196-202. doi: 10.1177/0218492318759105. Epub 2018 Feb 15.,Busro PW,Asian Cardiovasc Thorac Ann,2018,2018/02/17,,,10.1177/0218492318759105
2456,30031451,Salt-losing tubulopathy and chronic dermatitis,"Fernández-Fernández M, Gil-Peña H, Coto E, García Pérez N, Santos F.",Kidney Int. 2018 Aug;94(2):433. doi: 10.1016/j.kint.2017.12.007.,Fernández-Fernández M,Kidney Int,2018,2018/07/23,,,10.1016/j.kint.2017.12.007
2457,29529424,"Iodine deficiency in pregnancy: Still a health issue for the women of Cassino city, Italy","Tuccilli C, Baldini E, Truppa E, D'Auria B, De Quattro D, Cacciola G, Aceti T, Cirillo G, Faiola A, Indigeno P, D'Aliesio L, Gazzellone F, Bononi M, D'Armiento E, Carbotta G, Pironi D, Catania A, Sorrenti S, Ulisse S.",Nutrition. 2018 Jun;50:60-65. doi: 10.1016/j.nut.2017.11.007. Epub 2017 Nov 27.,Tuccilli C,Nutrition,2018,2018/03/13,,,10.1016/j.nut.2017.11.007
2458,24995978,Glucose regulates mitochondrial motility via Milton modification by O-GlcNAc transferase,"Pekkurnaz G, Trinidad JC, Wang X, Kong D, Schwarz TL.",Cell. 2014 Jul 3;158(1):54-68. doi: 10.1016/j.cell.2014.06.007.,Pekkurnaz G,Cell,2014,2014/07/05,PMC4224014,NIHMS604258,10.1016/j.cell.2014.06.007
2459,30201950,Hepatic Ago2-mediated RNA silencing controls energy metabolism linked to AMPK activation and obesity-associated pathophysiology,"Zhang C, Seo J, Murakami K, Salem ESB, Bernhard E, Borra VJ, Choi K, Yuan CL, Chan CC, Chen X, Huang T, Weirauch MT, Divanovic S, Qi NR, Thomas HE, Mercer CA, Siomi H, Nakamura T.",Nat Commun. 2018 Sep 10;9(1):3658. doi: 10.1038/s41467-018-05870-6.,Zhang C,Nat Commun,2018,2018/09/12,PMC6131149,,10.1038/s41467-018-05870-6
2460,38073570,Upregulation of miR-21-5p rescues the inhibition of cardiomyocyte proliferation induced by high glucose through negative regulation of Rhob,"Wu F, Wang F, Yang Q, Zhang Y, Cai K, Zhang J, Xia M, Wang Y, Wang X, Gui Y, Li Q.",J Dev Orig Health Dis. 2023 Oct;14(5):670-677. doi: 10.1017/S2040174423000351. Epub 2023 Dec 11.,Wu F,J Dev Orig Health Dis,2023,2023/12/11,,,10.1017/S2040174423000351
2461,7674011,Use of indomethacin in brain-injured patients with cerebral perfusion pressure impairment: preliminary report,"Biestro AA, Alberti RA, Soca AE, Cancela M, Puppo CB, Borovich B.",J Neurosurg. 1995 Oct;83(4):627-30. doi: 10.3171/jns.1995.83.4.0627.,Biestro AA,J Neurosurg,1995,1995/10/01,,,10.3171/jns.1995.83.4.0627
2462,1653155,"Elevated extracellular glucose inhibits an adenosine-(Na+,K+)-ATPase regulatory system in rabbit aortic wall","Simmons DA, Winegrad AI.",Diabetologia. 1991 Mar;34(3):157-63. doi: 10.1007/BF00418269.,Simmons DA,Diabetologia,1991,1991/03/01,,,10.1007/BF00418269
2463,27814504,Inflammation Improves Glucose Homeostasis through IKKβ-XBP1s Interaction,"Liu J, Ibi D, Taniguchi K, Lee J, Herrema H, Akosman B, Mucka P, Salazar Hernandez MA, Uyar MF, Park SW, Karin M, Ozcan U.",Cell. 2016 Nov 3;167(4):1052-1066.e18. doi: 10.1016/j.cell.2016.10.015.,Liu J,Cell,2016,2016/11/05,PMC5908236,NIHMS823434,10.1016/j.cell.2016.10.015
2464,7972149,The use of uniformly labelled substrates and mass isotopomer analysis to study intermediary metabolism,"Berthold HK, Wykes LJ, Jahoor F, Klein PD, Reeds PJ.",Proc Nutr Soc. 1994 Jul;53(2):345-54. doi: 10.1079/pns19940040.,Berthold HK,Proc Nutr Soc,1994,1994/07/01,,,10.1079/pns19940040
2465,16369318,A 2-month-old with persistent diarrhea,"Jacobstein D, Markowitz J, Mamula P.",MedGenMed. 2005 Mar 10;7(1):13.,Jacobstein D,MedGenMed,2005,2005/12/22,PMC1681397,,
2466,34293372,Effect of Early Feeding on Intestinal Permeability and Inflammation Markers in Infants with Genetic Susceptibility to Type 1 Diabetes: A Randomized Clinical Trial,"Siljander H, Jason E, Ruohtula T, Selvenius J, Koivusaari K, Salonen M, Ahonen S, Honkanen J, Ilonen J, Vaarala O, Virtanen SM, Lähdeaho ML, Knip M.",J Pediatr. 2021 Nov;238:305-311.e3. doi: 10.1016/j.jpeds.2021.07.042. Epub 2021 Jul 20.,Siljander H,J Pediatr,2021,2021/07/22,,,10.1016/j.jpeds.2021.07.042
2467,31514440,The Endocrine Function of Osteocalcin Regulated by Bone Resorption: A Lesson from Reduced and Increased Bone Mass Diseases,"Rossi M, Battafarano G, Pepe J, Minisola S, Del Fattore A.",Int J Mol Sci. 2019 Sep 11;20(18):4502. doi: 10.3390/ijms20184502.,Rossi M,Int J Mol Sci,2019,2019/09/14,PMC6769834,,10.3390/ijms20184502
2468,34354117,"Antimicrobial susceptibilities and comparative whole genome analysis of two isolates of the probiotic bacterium Lactiplantibacillus plantarum, strain ATCC 202195","Pell LG, Horne RG, Huntley S, Rahman H, Kar S, Islam MS, Evans KC, Saha SK, Campigotto A, Morris SK, Roth DE, Sherman PM.",Sci Rep. 2021 Aug 5;11(1):15893. doi: 10.1038/s41598-021-94997-6.,Pell LG,Sci Rep,2021,2021/08/06,PMC8342526,,10.1038/s41598-021-94997-6
2469,39003656,Compound heterozygous variants in SLC45A1 might cause syndromic intellectual disability by localization failure and activity attenuation in cells,"Zhou C, Zhu J, Tang P, Zhu J, Zhu X, Yang L, Bian W, Zhao W, Liu X.",Clin Genet. 2024 Nov;106(5):638-643. doi: 10.1111/cge.14588. Epub 2024 Jul 14.,Zhou C,Clin Genet,2024,2024/07/14,,,10.1111/cge.14588
2470,36139434,Hyperactive Akt1 Signaling Increases Tumor Progression and DNA Repair in Embryonal Rhabdomyosarcoma RD Line and Confers Susceptibility to Glycolysis and Mevalonate Pathway Inhibitors,"Codenotti S, Zizioli D, Mignani L, Rezzola S, Tabellini G, Parolini S, Giacomini A, Asperti M, Poli M, Mandracchia D, Vezzoli M, Bernardi S, Russo D, Mitola S, Monti E, Triggiani L, Tomasini D, Gastaldello S, Cassandri M, Rota R, Marampon F, Fanzani A.",Cells. 2022 Sep 14;11(18):2859. doi: 10.3390/cells11182859.,Codenotti S,Cells,2022,2022/09/23,PMC9497225,,10.3390/cells11182859
2471,17943178,Human skin keloid fibroblasts display bioenergetics of cancer cells,"Vincent AS, Phan TT, Mukhopadhyay A, Lim HY, Halliwell B, Wong KP.",J Invest Dermatol. 2008 Mar;128(3):702-9. doi: 10.1038/sj.jid.5701107. Epub 2007 Oct 18.,Vincent AS,J Invest Dermatol,2008,2007/10/19,,,10.1038/sj.jid.5701107
2472,10564769,Clostridium innocuum: a glucoseureide-splitting inhabitant of the human intestinal tract,"Mohr C, Heine WE, Wutzke KD.",Biochim Biophys Acta. 1999 Nov 16;1472(3):550-4. doi: 10.1016/s0304-4165(99)00162-2.,Mohr C,Biochim Biophys Acta,1999,1999/11/24,,,10.1016/s0304-4165(99)00162-2
2473,29437883,Cerebrospinal Fluid Reference Values for Young Infants Undergoing Lumbar Puncture,"Thomson J, Sucharew H, Cruz AT, Nigrovic LE, Freedman SB, Garro AC, Balamuth F, Mistry RD, Arms JL, Ishimine PT, Kulik DM, Neuman MI, Shah SS; Pediatric Emergency Medicine Collaborative Research Committee (PEM CRC) HSV Study Group.",Pediatrics. 2018 Mar;141(3):e20173405. doi: 10.1542/peds.2017-3405. Epub 2018 Feb 2.,Thomson J,Pediatrics,2018,2018/02/14,,,10.1542/peds.2017-3405
2474,10896230,Sucrose formulated recombinant human antihemophilic factor VIII is safe and efficacious for treatment of hemophilia A in home therapy--International Kogenate-FS Study Group,"Abshire TC, Brackmann HH, Scharrer I, Hoots K, Gazengel C, Powell JS, Gorina E, Kellermann E, Vosburgh E.",Thromb Haemost. 2000 Jun;83(6):811-6.,Abshire TC,Thromb Haemost,2000,2000/07/15,,,
2475,10364634,In vivo measurements of glucose absorption in preterm infants,Shulman RJ.,Biol Neonate. 1999 Jul;76(1):10-8. doi: 10.1159/000014126.,Shulman RJ,Biol Neonate,1999,1999/06/12,,,10.1159/000014126
2476,10802765,Drug-induced changes in cerebral glucose consumption in bifrontal epilepsy,"Matheja P, Weckesser M, Debus O, Löttgen J, Schuierer G, Schober O, Kurlemann G.",Epilepsia. 2000 May;41(5):588-93. doi: 10.1111/j.1528-1157.2000.tb00213.x.,Matheja P,Epilepsia,2000,2000/05/10,,,10.1111/j.1528-1157.2000.tb00213.x
2477,8581775,Pathophysiology and pathogenesis of visceral fat obesity,"Matsuzawa Y, Shimomura I, Nakamura T, Keno Y, Kotani K, Tokunaga K.",Obes Res. 1995 Sep;3 Suppl 2:187S-194S. doi: 10.1002/j.1550-8528.1995.tb00462.x.,Matsuzawa Y,Obes Res,1995,1995/09/01,,,10.1002/j.1550-8528.1995.tb00462.x
2478,38319732,PI3K/mTOR is a therapeutically targetable genetic dependency in diffuse intrinsic pontine glioma,"Duchatel RJ, Jackson ER, Parackal SG, Kiltschewskij D, Findlay IJ, Mannan A, Staudt DE, Thomas BC, Germon ZP, Laternser S, Kearney PS, Jamaluddin MFB, Douglas AM, Beitaki T, McEwen HP, Persson ML, Hocke EA, Jain V, Aksu M, Manning EE, Murray HC, Verrills NM, Sun CX, Daniel P, Vilain RE, Skerrett-Byrne DA, Nixon B, Hua S, de Bock CE, Colino-Sanguino Y, Valdes-Mora F, Tsoli M, Ziegler DS, Cairns MJ, Raabe EH, Vitanza NA, Hulleman E, Phoenix TN, Koschmann C, Alvaro F, Dayas CV, Tinkle CL, Wheeler H, Whittle JR, Eisenstat DD, Firestein R, Mueller S, Valvi S, Hansford JR, Ashley DM, Gregory SG, Kilburn LB, Nazarian J, Cain JE, Dun MD.",J Clin Invest. 2024 Feb 6;134(6):e170329. doi: 10.1172/JCI170329.,Duchatel RJ,J Clin Invest,2024,2024/02/06,PMC10940093,,10.1172/JCI170329
2479,29180700,Autophagy protects pancreatic beta cell mass and function in the setting of a high-fat and high-glucose diet,"Sheng Q, Xiao X, Prasadan K, Chen C, Ming Y, Fusco J, Gangopadhyay NN, Ricks D, Gittes GK.",Sci Rep. 2017 Nov 27;7(1):16348. doi: 10.1038/s41598-017-16485-0.,Sheng Q,Sci Rep,2017,2017/11/29,PMC5703965,,10.1038/s41598-017-16485-0
2480,38515292,Acute Fetal Metabolomic Changes in Twins Undergoing Fetoscopic Surgery for Twin-Twin Transfusion Syndrome,"Forde B, Martin S, Watanabe-Chailland M, Lim FY.",Twin Res Hum Genet. 2024 Feb;27(1):56-63. doi: 10.1017/thg.2024.10. Epub 2024 Mar 22.,Forde B,Twin Res Hum Genet,2024,2024/03/22,,,10.1017/thg.2024.10
2481,27576956,"Pediatric Crohn's disease, iron deficiency anemia and intravenous iron treatment: a follow-up study","Valério de Azevedo S, Maltez C, Lopes AI.",Scand J Gastroenterol. 2017 Jan;52(1):29-33. doi: 10.1080/00365521.2016.1224381. Epub 2016 Aug 31.,Valério de Azevedo S,Scand J Gastroenterol,2017,2016/09/01,,,10.1080/00365521.2016.1224381
2482,28274169,Safety and efficacy of topiramate in neonates with hypoxic ischemic encephalopathy treated with hypothermia (NeoNATI): a feasibility study,"Filippi L, Fiorini P, Catarzi S, Berti E, Padrini L, Landucci E, Donzelli G, Bartalena L, Fiorentini E, Boldrini A, Giampietri M, Scaramuzzo RT, la Marca G, Della Bona ML, Fiori S, Tinelli F, Bancale A, Guzzetta A, Cioni G, Pisano T, Falchi M, Guerrini R.",J Matern Fetal Neonatal Med. 2018 Apr;31(8):973-980. doi: 10.1080/14767058.2017.1304536. Epub 2017 Mar 28.,Filippi L,J Matern Fetal Neonatal Med,2018,2017/03/10,,,10.1080/14767058.2017.1304536
2483,38206362,NRF2 is required for neonatal mouse beta cell growth by maintaining redox balance and promoting mitochondrial biogenesis and function,"Baumel-Alterzon S, Katz LS, Lambertini L, Tse I, Heidery F, Garcia-Ocaña A, Scott DK.",Diabetologia. 2024 Mar;67(3):547-560. doi: 10.1007/s00125-023-06071-7. Epub 2024 Jan 11.,Baumel-Alterzon S,Diabetologia,2024,2024/01/11,PMC11521447,NIHMS2029042,10.1007/s00125-023-06071-7
2484,34590575,[Research progress on the roles and mechanisms underlying metabolic molecules involved in nutrition therapy and immune regulation in sepsis],"Liu T, Zhang Y, Wang C.",Zhonghua Wei Zhong Bing Ji Jiu Yi Xue. 2021 Aug;33(8):1017-1020. doi: 10.3760/cma.j.cn121430-20210326-00445.,Liu T,Zhonghua Wei Zhong Bing Ji Jiu Yi Xue,2021,2021/09/30,,,10.3760/cma.j.cn121430-20210326-00445
2485,12168240,Glucose extremes in newborn infants,"Sunehag AL, Haymond MW.",Clin Perinatol. 2002 Jun;29(2):245-60. doi: 10.1016/s0095-5108(02)00006-4.,Sunehag AL,Clin Perinatol,2002,2002/08/10,,,10.1016/s0095-5108(02)00006-4
2486,11225182,Acceptability of extrusion cooked cereal/legume weaning food supplements to Ghanaian mothers,"Mensa-Wilmot Y, Phillips RD, Sefa-Dedeh S.",Int J Food Sci Nutr. 2001 Jan;52(1):83-90.,Mensa-Wilmot Y,Int J Food Sci Nutr,2001,2001/02/28,,,
2487,27777371,Ambulatory Glucose Profile Applied to Flash Glucose Monitoring in Real Life: An Expert Opinion,"Maran A, Esposito K, Toni S, Giordano C.",J Diabetes Sci Technol. 2017 May;11(3):633-634. doi: 10.1177/1932296816674739. Epub 2016 Oct 24.,Maran A,J Diabetes Sci Technol,2017,2016/11/06,PMC5505419,,10.1177/1932296816674739
2488,26796048,Clinical recommendations for oral management of patients with primary antibody deficiencies,"Yousefi H, Aghamohammadi A, Rezaei N.",Expert Rev Clin Immunol. 2016;12(4):359-60. doi: 10.1586/1744666X.2016.1145055. Epub 2016 Feb 10.,Yousefi H,Expert Rev Clin Immunol,2016,2016/01/23,,,10.1586/1744666X.2016.1145055
2489,7745004,Long term exposure to fatty acids and ketones inhibits B-cell functions in human pancreatic islets of Langerhans,"Zhou YP, Grill V.",J Clin Endocrinol Metab. 1995 May;80(5):1584-90. doi: 10.1210/jcem.80.5.7745004.,Zhou YP,J Clin Endocrinol Metab,1995,1995/05/01,,,10.1210/jcem.80.5.7745004
2490,38462210,A maternal low-protein diet impaired glucose metabolism and altered the lncRNA profiles of islets in adult offspring,"Li Y, Chen Y, Lin B, Liu Z, Xu F, Song D, Che K, Chen D, Su Y, Li W, Xu W.",J Nutr Biochem. 2024 Jun;128:109618. doi: 10.1016/j.jnutbio.2024.109618. Epub 2024 Mar 10.,Li Y,J Nutr Biochem,2024,2024/03/10,,,10.1016/j.jnutbio.2024.109618
2491,10913936,Increased prevalence of thyroglobulin antibodies in Sri Lankan schoolgirls--is iodine the cause?,"Premawardhana LD, Parkes AB, Smyth PP, Wijeyaratne CN, Jayasinghe A, de Silva DG, Lazarus JH.",Eur J Endocrinol. 2000 Aug;143(2):185-8. doi: 10.1530/eje.0.1430185.,Premawardhana LD,Eur J Endocrinol,2000,2000/07/29,,,10.1530/eje.0.1430185
2492,15224711,Combined treatment with vigabatrin and topiramate in West syndrome,"Buoni S, Zannolli R, Strambi M, Fois A.",J Child Neurol. 2004 May;19(5):385-6. doi: 10.1177/088307380401900512.,Buoni S,J Child Neurol,2004,2004/07/01,,,10.1177/088307380401900512
2493,16225812,Efficacy and tolerability of topiramate in children younger than 2 years old,"Valencia I, Fons C, Kothare SV, Khurana DS, Yum S, Hardison HH, Legido A.",J Child Neurol. 2005 Aug;20(8):667-9. doi: 10.1177/08830738050200080601.,Valencia I,J Child Neurol,2005,2005/10/18,,,10.1177/08830738050200080601
2494,20337988,Exercise-induced wheeze: Fraction of exhaled nitric oxide-directed management,"Cowan DC, Hewitt RS, Cowan JO, Palmay R, Williamson A, Lucas SJ, Murrell CJ, Thomas KN, Taylor DR.",Respirology. 2010 May;15(4):683-90. doi: 10.1111/j.1440-1843.2010.01740.x. Epub 2010 Mar 16.,Cowan DC,Respirology,2010,2010/03/27,,,10.1111/j.1440-1843.2010.01740.x
2495,39426745,Pesticide residues in common and herbal teas combined with risk assessment and transfer to the infusion,"Kaczyński P, Iwaniuk P, Jankowska M, Orywal K, Socha K, Perkowski M, Farhan JA, Lozowicka B.",Chemosphere. 2024 Oct 17:143550. doi: 10.1016/j.chemosphere.2024.143550. Online ahead of print.,Kaczyński P,Chemosphere,2024,2024/10/19,,,10.1016/j.chemosphere.2024.143550
2496,35994205,Monitoring and treating hypoglycemia during meal-based rapid nutritional rehabilitation in patients with extreme anorexia nervosa,"Fischer LK, Schreyer CC, Pletch A, Cooper M, Vanzhula IA, Redgrave GW, Guarda AS.",Eat Weight Disord. 2022 Dec;27(8):3301-3308. doi: 10.1007/s40519-022-01460-0. Epub 2022 Aug 22.,Fischer LK,Eat Weight Disord,2022,2022/08/22,,,10.1007/s40519-022-01460-0
2497,36809030,The Gut Commensal Escherichia coli Aggravates High-Fat-Diet-Induced Obesity and Insulin Resistance in Mice,"Ju T, Bourrie BCT, Forgie AJ, Pepin DM, Tollenaar S, Sergi CM, Willing BP.",Appl Environ Microbiol. 2023 Mar 29;89(3):e0162822. doi: 10.1128/aem.01628-22. Epub 2023 Feb 21.,Ju T,Appl Environ Microbiol,2023,2023/02/22,PMC10057047,,10.1128/aem.01628-22
2498,19234837,Combination of oral ketamine and midazolam as a premedication for a severely autistic and combative patient,"Shah S, Shah S, Apuya J, Gopalakrishnan S, Martin T.",J Anesth. 2009;23(1):126-8. doi: 10.1007/s00540-008-0685-4. Epub 2009 Feb 22.,Shah S,J Anesth,2009,2009/02/24,,,10.1007/s00540-008-0685-4
2499,30220668,Place of phytotherapy in the treatment of acute infections of upper respiratory tract and upper gastrointestinal tract,"Pietruszewska W, Barańska M, Wielgat J.",Otolaryngol Pol. 2018 Aug 31;72(4):42-50. doi: 10.5604/01.3001.0012.2833.,Pietruszewska W,Otolaryngol Pol,2018,2018/09/18,,,10.5604/01.3001.0012.2833
2500,37827418,"Diethylaminoethyl-dextran and monocyte cell membrane coated 1,8-cineole delivery system for intracellular delivery and synergistic treatment of atherosclerosis","Jiang F, Wu G, Yang H, Zhang Y, Shen X, Tao L.",Int J Biol Macromol. 2023 Dec 31;253(Pt 7):127365. doi: 10.1016/j.ijbiomac.2023.127365. Epub 2023 Oct 10.,Jiang F,Int J Biol Macromol,2023,2023/10/12,,,10.1016/j.ijbiomac.2023.127365
2501,37657063,Analysis of risk factors of neonatal hypoglycemia and its correlation with blood glucose control of gestational diabetes mellitus: A retrospective study,"Cao Y, Yang Y, Liu L, Ma J.",Medicine (Baltimore). 2023 Sep 1;102(35):e34619. doi: 10.1097/MD.0000000000034619.,Cao Y,Medicine (Baltimore),2023,2023/09/01,PMC10476708,,10.1097/MD.0000000000034619
2502,23834221,Mucosal permeability testing: should interpretation change or stay the same?,"Rafati DS, Shulman RJ.",Neurogastroenterol Motil. 2013 Oct;25(10):854. doi: 10.1111/nmo.12179. Epub 2013 Jul 8.,Rafati DS,Neurogastroenterol Motil,2013,2013/07/10,PMC3787950,NIHMS496316,10.1111/nmo.12179
2503,31935149,Fructose and hepatic insulin resistance,"Softic S, Stanhope KL, Boucher J, Divanovic S, Lanaspa MA, Johnson RJ, Kahn CR.",Crit Rev Clin Lab Sci. 2020 Aug;57(5):308-322. doi: 10.1080/10408363.2019.1711360. Epub 2020 Jan 14.,Softic S,Crit Rev Clin Lab Sci,2020,2020/01/15,PMC7774304,NIHMS1550215,10.1080/10408363.2019.1711360
2504,32826256,Effect of Collection Tube Type on Glucose Stability in Whole Blood,"Jung J, Garnett E, Rector K, Jariwala P, Devaraj S.",Ann Clin Lab Sci. 2020 Jul;50(4):557-559.,Jung J,Ann Clin Lab Sci,2020,2020/08/23,,,
2505,20797551,"Ultrasonography in regenerative injection (prolotherapy) using dextrose, platelet-rich plasma, and other injectants","Fullerton BD, Reeves KD.",Phys Med Rehabil Clin N Am. 2010 Aug;21(3):585-605. doi: 10.1016/j.pmr.2010.06.003.,Fullerton BD,Phys Med Rehabil Clin N Am,2010,2010/08/28,,,10.1016/j.pmr.2010.06.003
2506,33404139,Effect of hTIMP-1 overexpression in human umbilical cord mesenchymal stem cells on the repair of pancreatic islets in type-1 diabetic mice,"Bao Y, Zhao Z, Gao H.",Cell Biol Int. 2021 May;45(5):1038-1049. doi: 10.1002/cbin.11548. Epub 2021 Feb 4.,Bao Y,Cell Biol Int,2021,2021/01/06,,,10.1002/cbin.11548
2507,21037297,Raman spectroscopy of xylitol uptake and metabolism in Gram-positive and Gram-negative bacteria,"Palchaudhuri S, Rehse SJ, Hamasha K, Syed T, Kurtovic E, Kurtovic E, Stenger J.",Appl Environ Microbiol. 2011 Jan;77(1):131-7. doi: 10.1128/AEM.01458-10. Epub 2010 Oct 29.,Palchaudhuri S,Appl Environ Microbiol,2011,2010/11/02,PMC3019703,,10.1128/AEM.01458-10
2508,36314120,Long-Term Adiposity and Midlife Carotid Intima-Media Thickness Are Linked Partly Through Intermediate Risk Factors,"Zhang T, Fan B, Li S, Wang X, Kong Y, Bazzano L, He J, Chen W, Yan Y.",Hypertension. 2023 Jan;80(1):160-168. doi: 10.1161/HYPERTENSIONAHA.122.20217. Epub 2022 Oct 31.,Zhang T,Hypertension,2023,2022/10/31,PMC9742127,NIHMS1843106,10.1161/HYPERTENSIONAHA.122.20217
