,PMID,Title,Authors,Citation,First Author,Journal/Book,Publication Year,Create Date,PMCID,NIHMS ID,DOI
2221,31150410,Iodine status of reproductive age women and their toddlers in northern Ghana improved through household supply of iodized salt and weekly indigenous meal consumption,"Kubuga CK, Abizari AR, Song WO.",PLoS One. 2019 May 31;14(5):e0216931. doi: 10.1371/journal.pone.0216931. eCollection 2019.,Kubuga CK,PLoS One,2019,2019/06/01,PMC6544231,,10.1371/journal.pone.0216931
2222,37597336,Combined PMM2-CDG and hereditary fructose intolerance in a patient with mild clinical presentation,"Hong X, Edmondson AC, Strong A, Pomerantz D, Michl E, Berry G, He M.",Mol Genet Metab. 2023 Nov;140(3):107682. doi: 10.1016/j.ymgme.2023.107682. Epub 2023 Aug 9.,Hong X,Mol Genet Metab,2023,2023/08/19,PMC10840806,NIHMS1925883,10.1016/j.ymgme.2023.107682
2223,23462940,Iodine status in schoolchildren living in northeast Italy: the importance of iodized-salt use and milk consumption,"Watutantrige Fernando S, Barollo S, Nacamulli D, Pozza D, Giachetti M, Frigato F, Redaelli M, Zagotto G, Girelli ME, Mantero F, Mian C.",Eur J Clin Nutr. 2013 Apr;67(4):366-70. doi: 10.1038/ejcn.2013.44. Epub 2013 Mar 6.,Watutantrige Fernando S,Eur J Clin Nutr,2013,2013/03/07,,,10.1038/ejcn.2013.44
2224,22933439,Longitudinal effects of MRI-measured hepatic steatosis on biomarkers of glucose homeostasis and hepatic apoptosis in obese youth,"Kim G, Giannini C, Pierpont B, Feldstein AE, Santoro N, Kursawe R, Shaw M, Duran E, Goldberg R, Dziura J, Caprio S.",Diabetes Care. 2013 Jan;36(1):130-6. doi: 10.2337/dc12-0277. Epub 2012 Aug 28.,Kim G,Diabetes Care,2013,2012/08/31,PMC3526202,,10.2337/dc12-0277
2225,26802864,E-cigarette regulation and policy: UK vapers' perspectives,Farrimond H.,Addiction. 2016 Jun;111(6):1077-83. doi: 10.1111/add.13322. Epub 2016 Mar 14.,Farrimond H,Addiction,2016,2016/01/24,,,10.1111/add.13322
2226,35999051,The utility of glucose area under the curve from the oral glucose tolerance test as a screening tool for cystic fibrosis-related diabetes,"Gileles-Hillel A, Soesman LH, Miari S, Breuer O, Tsabari R, Elyashar-Earon H, Armoni S, Sprikkelman AB, Reiter J, Zangen D, Lavi E, Kerem E, Cohen-Cymberknoh M.",Pediatr Pulmonol. 2022 Nov;57(11):2774-2780. doi: 10.1002/ppul.26100. Epub 2022 Sep 6.,Gileles-Hillel A,Pediatr Pulmonol,2022,2022/08/23,,,10.1002/ppul.26100
2227,16194268,Management of atypical antipsychotic-induced weight gain in schizophrenic patients with topiramate,"Lin YH, Liu CY, Hsiao MC.",Psychiatry Clin Neurosci. 2005 Oct;59(5):613-5. doi: 10.1111/j.1440-1819.2005.01424.x.,Lin YH,Psychiatry Clin Neurosci,2005,2005/10/01,,,10.1111/j.1440-1819.2005.01424.x
2228,34680961,"Hyperinsulinemic Hypoglycemia in Three Generations of a Family with Glucokinase Activating Mutation, c.295T>C (p.Trp99Arg)","Gilis-Januszewska A, Bogusławska A, Kowalik A, Rzepka E, Soczówka K, Przybylik-Mazurek E, Głowa B, Hubalewska-Dydejczyk A.",Genes (Basel). 2021 Oct 1;12(10):1566. doi: 10.3390/genes12101566.,Gilis-Januszewska A,Genes (Basel),2021,2021/10/23,PMC8535713,,10.3390/genes12101566
2229,20061785,Iodine intake is still inadequate among pregnant women eight years after mandatory iodination of salt in Turkey,"Kut A, Gursoy A, Senbayram S, Bayraktar N, Budakoğlu II, Akgün HS.",J Endocrinol Invest. 2010 Jul-Aug;33(7):461-4. doi: 10.1007/BF03346625. Epub 2009 Dec 22.,Kut A,J Endocrinol Invest,2010,2010/01/12,,,10.1007/BF03346625
2230,31051506,Dose-response relation between dietary sodium and blood pressure: a meta-regression analysis of 133 randomized controlled trials,"Graudal N, Hubeck-Graudal T, Jürgens G, Taylor RS.",Am J Clin Nutr. 2019 May 1;109(5):1273-1278. doi: 10.1093/ajcn/nqy384.,Graudal N,Am J Clin Nutr,2019,2019/05/04,,,10.1093/ajcn/nqy384
2231,36203176,Severe hyponatremia in an infant with epidermolysis bullosa: a case report,"Dehghani S, Akbarzadeh Pasha B, Karimi A, Afshin A.",J Med Case Rep. 2022 Oct 7;16(1):358. doi: 10.1186/s13256-022-03601-6.,Dehghani S,J Med Case Rep,2022,2022/10/06,PMC9540733,,10.1186/s13256-022-03601-6
2232,36678252,"Ultra-Processed Food Consumption Is Related to Higher Trans Fatty Acids, Sugar Intake, and Micronutrient-Impaired Status in Schoolchildren of Bahia, Brazil","Menezes CA, Magalhães LB, da Silva JT, da Silva Lago RMR, Gomes AN, Ladeia AMT, Vianna NA, Oliveira RR.",Nutrients. 2023 Jan 12;15(2):381. doi: 10.3390/nu15020381.,Menezes CA,Nutrients,2023,2023/01/21,PMC9863107,,10.3390/nu15020381
2233,17763170,Early and intensive fluid replacement prevents acute renal failure in the crush cases associated with spontaneous collapse of an apartment in Konya,"Altintepe L, Guney I, Tonbul Z, Türk S, Mazi M, Ağca E, Yeksan M.",Ren Fail. 2007;29(6):737-41. doi: 10.1080/08860220701460095.,Altintepe L,Ren Fail,2007,2007/09/01,,,10.1080/08860220701460095
2234,3946699,Oral rehydration in China,"Taylor CE, Yu XZ.",Am J Public Health. 1986 Feb;76(2):187-9. doi: 10.2105/ajph.76.2.187.,Taylor CE,Am J Public Health,1986,1986/02/01,PMC1646497,,10.2105/ajph.76.2.187
2235,19650789,Potential roles of high salt intake and maternal malnutrition in the development of hypertension in disadvantaged populations,"Thrift AG, Srikanth V, Fitzgerald SM, Kalyanram K, Kartik K, Hoppe CC, Walker KZ, Evans RG.",Clin Exp Pharmacol Physiol. 2010 Feb;37(2):e78-90. doi: 10.1111/j.1440-1681.2009.05266.x. Epub 2009 Jul 24.,Thrift AG,Clin Exp Pharmacol Physiol,2010,2009/08/05,,,10.1111/j.1440-1681.2009.05266.x
2236,31373012,A novel protocol for cryopreservation of paediatric red blood cell units allows increased availability of rare blood types,"Larsson L, Larsson S, Derving J, Watz E, Uhlin M.",Vox Sang. 2019 Oct;114(7):711-720. doi: 10.1111/vox.12829. Epub 2019 Aug 1.,Larsson L,Vox Sang,2019,2019/08/03,,,10.1111/vox.12829
2237,2787998,[Positron emission tomographic evaluations on hemodynamics and glucose metabolism of brain tumors and perifocal edematous tissues],"Mizukawa N, Hino A, Imahori Y, Tenjin H, Yano I, Yoshino E, Hirakawa K, Yamashita M, Oki F, Nakahashi H.",No To Shinkei. 1989 Mar;41(3):251-8.,Mizukawa N,No To Shinkei,1989,1989/03/01,,,
2238,19880909,Inhaled mannitol improves the hydration and surface properties of sputum in patients with cystic fibrosis,"Daviskas E, Anderson SD, Jaques A, Charlton B.",Chest. 2010 Apr;137(4):861-8. doi: 10.1378/chest.09-2017. Epub 2009 Oct 31.,Daviskas E,Chest,2010,2009/11/03,,,10.1378/chest.09-2017
2239,34541356,"Optimization of nutritional and sensory qualities of complementary foods prepared from sorghum, soybean, karkade and premix in Benishangul - Gumuz region, Ethiopia","Keyata EO, Tola YB, Bultosa G, Forsido SF.",Heliyon. 2021 Sep 7;7(9):e07955. doi: 10.1016/j.heliyon.2021.e07955. eCollection 2021 Sep.,Keyata EO,Heliyon,2021,2021/09/20,PMC8436067,,10.1016/j.heliyon.2021.e07955
2240,22407754,Neurodevelopmental features in 2q23.1 microdeletion syndrome: report of a new patient with intractable seizures and review of literature,"Motobayashi M, Nishimura-Tadaki A, Inaba Y, Kosho T, Miyatake S, Niimi T, Nishimura T, Wakui K, Fukushima Y, Matsumoto N, Koike K.",Am J Med Genet A. 2012 Apr;158A(4):861-8. doi: 10.1002/ajmg.a.35235. Epub 2012 Mar 9.,Motobayashi M,Am J Med Genet A,2012,2012/03/13,,,10.1002/ajmg.a.35235
2241,35357471,Fetal Exposure to Cannabis and Childhood Metabolic Outcomes: The Healthy Start Study,"Moore BF, Sauder KA, Shapiro ALB, Crume T, Kinney GL, Dabelea D.",J Clin Endocrinol Metab. 2022 Jun 16;107(7):e2862-e2869. doi: 10.1210/clinem/dgac101.,Moore BF,J Clin Endocrinol Metab,2022,2022/03/31,PMC9202691,,10.1210/clinem/dgac101
2242,11836923,Current status of iodine deficiency in Mongolia in 1998-1999,"Yamada C, Oyunchimeg D, Enkhtuya P, Erdenbat A, Buttumur A, Umenai T.",Asia Pac J Public Health. 2000;12(2):79-84. doi: 10.1177/101053950001200205.,Yamada C,Asia Pac J Public Health,2000,2002/02/12,,,10.1177/101053950001200205
2243,38201104,Current Innovations in the Development of Functional Gummy Candies,"Tarahi M, Tahmouzi S, Kianiani MR, Ezzati S, Hedayati S, Niakousari M.",Foods. 2023 Dec 25;13(1):76. doi: 10.3390/foods13010076.,Tarahi M,Foods,2023,2024/01/11,PMC10778822,,10.3390/foods13010076
2244,27881826,"A soft, wearable microfluidic device for the capture, storage, and colorimetric sensing of sweat","Koh A, Kang D, Xue Y, Lee S, Pielak RM, Kim J, Hwang T, Min S, Banks A, Bastien P, Manco MC, Wang L, Ammann KR, Jang KI, Won P, Han S, Ghaffari R, Paik U, Slepian MJ, Balooch G, Huang Y, Rogers JA.",Sci Transl Med. 2016 Nov 23;8(366):366ra165. doi: 10.1126/scitranslmed.aaf2593.,Koh A,Sci Transl Med,2016,2016/11/25,PMC5429097,NIHMS854155,10.1126/scitranslmed.aaf2593
2245,28166847,Salt and sugars content of breakfast cereals in the UK from 1992 to 2015,"Pombo-Rodrigues S, Hashem KM, He FJ, MacGregor GA.",Public Health Nutr. 2017 Jun;20(8):1500-1512. doi: 10.1017/S1368980016003463. Epub 2017 Feb 7.,Pombo-Rodrigues S,Public Health Nutr,2017,2017/02/08,PMC10261404,,10.1017/S1368980016003463
2246,36370077,Management of Hyperosmolar Hyperglycaemic State (HHS) in Adults: An updated guideline from the Joint British Diabetes Societies (JBDS) for Inpatient Care Group,"Mustafa OG, Haq M, Dashora U, Castro E, Dhatariya KK; Joint British Diabetes Societies (JBDS) for Inpatient Care Group.",Diabet Med. 2023 Mar;40(3):e15005. doi: 10.1111/dme.15005. Epub 2022 Dec 21.,Mustafa OG,Diabet Med,2023,2022/11/12,PMC10107355,,10.1111/dme.15005
2247,38574983,Pre-pregnancy ozone and ultrafine particulate matter exposure during second year of life associated with decreased cognitive and adaptive functioning at aged 2-5 years,"Goodrich AJ, Kleeman MJ, Tancredi DJ, Ludeña YJ, Bennett DH, Hertz-Picciotto I, Schmidt RJ.",Environ Res. 2024 Jul 1;252(Pt 1):118854. doi: 10.1016/j.envres.2024.118854. Epub 2024 Apr 3.,Goodrich AJ,Environ Res,2024,2024/04/04,,,10.1016/j.envres.2024.118854
2248,8990142,Necrosis of the gastrointestinal tract in uremic patients as a result of sodium polystyrene sulfonate (Kayexalate) in sorbitol: an underrecognized condition,"Rashid A, Hamilton SR.",Am J Surg Pathol. 1997 Jan;21(1):60-9. doi: 10.1097/00000478-199701000-00007.,Rashid A,Am J Surg Pathol,1997,1997/01/01,,,10.1097/00000478-199701000-00007
2249,33291491,Free Sugar Consumption and Obesity in European Adolescents: The HELENA Study,"Flieh SM, Moreno LA, Miguel-Berges ML, Stehle P, Marcos A, Molnár D, Widhalm K, Béghin L, De Henauw S, Kafatos A, Leclercq C, Gonzalez-Gross M, Dallongeville J, Molina-Hidalgo C, González-Gil EM.",Nutrients. 2020 Dec 5;12(12):3747. doi: 10.3390/nu12123747.,Flieh SM,Nutrients,2020,2020/12/09,PMC7762126,,10.3390/nu12123747
2250,25908676,Systematic review of the effects of iodised salt and iodine supplements on prenatal and postnatal growth: study protocol,"Farebrother J, Naude CE, Nicol L, Sang Z, Yang Z, Andersson M, Jooste PL, Zimmermann MB.",BMJ Open. 2015 Apr 23;5(4):e007238. doi: 10.1136/bmjopen-2014-007238.,Farebrother J,BMJ Open,2015,2015/04/25,PMC4410124,,10.1136/bmjopen-2014-007238
2251,35969998,Vitamin C deficiency induces hypoglycemia and cognitive disorder through S-nitrosylation-mediated activation of glycogen synthase kinase 3β,"Shu Y, Zou C, Cai Y, He Q, Wu X, Zhu H, Qv M, Chao Y, Xu C, Tang L, Wu X.",Redox Biol. 2022 Oct;56:102420. doi: 10.1016/j.redox.2022.102420. Epub 2022 Aug 8.,Shu Y,Redox Biol,2022,2022/08/15,PMC9399387,,10.1016/j.redox.2022.102420
2252,37661068,The chronic consumption of dietary fructose promotes the gut Clostridium species imbalance and bile acid alterations in developing nonalcoholic fatty liver disease,"Zhang D, Wang H, Liu A, Wang S, Xu C, Lan K, Xiang W, Zhu K, Xiao Y, Fu J, Jiang R, Chen W, Ni Y.",J Nutr Biochem. 2023 Nov;121:109434. doi: 10.1016/j.jnutbio.2023.109434. Epub 2023 Sep 1.,Zhang D,J Nutr Biochem,2023,2023/09/03,,,10.1016/j.jnutbio.2023.109434
2253,36173238,The Insulin-Only Bionic Pancreas Pivotal Trial Extension Study: A Multi-Center Single-Arm Evaluation of the Insulin-Only Configuration of the Bionic Pancreas in Adults and Youth with Type 1 Diabetes,"Lynch J, Kanapka LG, Russell SJ, Damiano ER, El-Khatib FH, Ruedy KJ, Balliro C, Calhoun P, Beck RW.",Diabetes Technol Ther. 2022 Oct;24(10):726-736. doi: 10.1089/dia.2022.0341.,Lynch J,Diabetes Technol Ther,2022,2022/09/29,PMC9529297,,10.1089/dia.2022.0341
2254,31972003,Metabolic and Genetic Determinants of Glucose Shape After Oral Challenge in Obese Youths: A Longitudinal Study,"Galderisi A, Tricò D, Dalla Man C, Santoro N, Pierpont B, Groop L, Cobelli C, Caprio S.",J Clin Endocrinol Metab. 2020 Feb 1;105(2):534-42. doi: 10.1210/clinem/dgz207.,Galderisi A,J Clin Endocrinol Metab,2020,2020/01/24,PMC6977541,,10.1210/clinem/dgz207
2255,38474874,The Association of Total Meat Intake with Cardio-Metabolic Disease Risk Factors and Measures of Sub-Clinical Atherosclerosis in an Urbanising Community of Southern India: A Cross-Sectional Analysis for the APCAPS Cohort,"Mahajan H, Mallinson PAC, Lieber J, Bhogadi S, Banjara SK, Reddy VS, Reddy GB, Kulkarni B, Kinra S.",Nutrients. 2024 Mar 5;16(5):746. doi: 10.3390/nu16050746.,Mahajan H,Nutrients,2024,2024/03/13,PMC10934090,,10.3390/nu16050746
2256,29198070,Sugar Detection Threshold After Laparoscopic Sleeve Gastrectomy in Adolescents,"Abdeen GN, Miras AD, Alqhatani AR, le Roux CW.",Obes Surg. 2018 May;28(5):1302-1307. doi: 10.1007/s11695-017-2999-5.,Abdeen GN,Obes Surg,2018,2017/12/04,,,10.1007/s11695-017-2999-5
2257,35577717,"The youth e-cigarette epidemic: updates and review of devices, epidemiology and regulation","Owotomo O, Walley S.",Curr Probl Pediatr Adolesc Health Care. 2022 Jun;52(6):101200. doi: 10.1016/j.cppeds.2022.101200. Epub 2022 May 13.,Owotomo O,Curr Probl Pediatr Adolesc Health Care,2022,2022/05/16,,,10.1016/j.cppeds.2022.101200
2258,35801348,Associations of maternal glucose markers in pregnancy with cord blood glucocorticoids and child hair cortisol levels,"Cohen N, Faleschini S, Rifas-Shiman SL, Bouchard L, Doyon M, Simard O, Arguin M, Fink G, Alman AC, Kirby R, Chen H, Wilson R, Fryer K, Perron P, Oken E, Hivert MF.",J Dev Orig Health Dis. 2023 Feb;14(1):88-95. doi: 10.1017/S2040174422000381. Epub 2022 Jul 8.,Cohen N,J Dev Orig Health Dis,2023,2022/07/08,PMC9825683,NIHMS1817237,10.1017/S2040174422000381
2259,28780627,Primary Pediatric Hypertension: Current Understanding and Emerging Concepts,"Tiu AC, Bishop MD, Asico LD, Jose PA, Villar VAM.",Curr Hypertens Rep. 2017 Sep;19(9):70. doi: 10.1007/s11906-017-0768-4.,Tiu AC,Curr Hypertens Rep,2017,2017/08/07,PMC6314210,NIHMS1003507,10.1007/s11906-017-0768-4
2260,37782145,Safety and Glycemic Outcomes During the MiniMed(TM) Advanced Hybrid Closed-Loop System Pivotal Trial in Children and Adolescents with Type 1 Diabetes,"Pihoker C, Shulman DI, Forlenza GP, Kaiserman KB, Sherr JL, Thrasher JR, Buckingham BA, Kipnes MS, Bode BW, Carlson AL, Lee SW, Latif K, Liljenquist DR, Slover RH, Dai Z, Niu F, Shin J, Jonkers RAM, Roy A, Grosman B, Vella M, Cordero TL, McVean J, Rhinehart AS, Vigersky RA; MiniMed AHCL Study Group.",Diabetes Technol Ther. 2023 Nov;25(11):755-764. doi: 10.1089/dia.2023.0255. Epub 2023 Oct 25.,Pihoker C,Diabetes Technol Ther,2023,2023/10/02,,,10.1089/dia.2023.0255
2261,2537194,Hypoglycemia in patients with non-islet cell tumors,Daughaday WH.,Endocrinol Metab Clin North Am. 1989 Mar;18(1):91-101.,Daughaday WH,Endocrinol Metab Clin North Am,1989,1989/03/01,,,
2262,11407106,Medical therapy of neurocardiogenic syncope,Cadman CS.,"Cardiol Clin. 2001 May;19(2):203-13, v. doi: 10.1016/s0733-8651(05)70208-3.",Cadman CS,Cardiol Clin,2001,2001/06/16,,,10.1016/s0733-8651(05)70208-3
2263,37205137,The tobacco-free fallacy: What paediatricians should know about herbal smoking products,"Khorasani A, Chadi N.",Paediatr Child Health. 2022 Sep 21;28(3):141-144. doi: 10.1093/pch/pxac096. eCollection 2023 Jun.,Khorasani A,Paediatr Child Health,2022,2023/05/19,PMC10186095,,10.1093/pch/pxac096
2264,32438659,The Effects of Two Intervention Strategies to Reduce the Intake of Salt and the Sodium-To-Potassium Ratio on Cardiovascular Risk Factors. A 4-Month Randomised Controlled Study among Healthy Families,"Toft U, Riis NL, Lassen AD, Trolle E, Andreasen AH, Frederiksen AKS, Joergensen NR, Munk JK, Bjoernsbo KS.",Nutrients. 2020 May 19;12(5):1467. doi: 10.3390/nu12051467.,Toft U,Nutrients,2020,2020/05/23,PMC7284652,,10.3390/nu12051467
2265,2673750,Treatment of 80 patients with Turner's syndrome with recombinant human growth hormone (YM-17798) for one year: the results of a multicentric study in Japan. Committee for the Treatment of Turner's Syndrome,"Takano K, Shizume K, Hibi I.",Endocrinol Jpn. 1989 Apr;36(2):253-60. doi: 10.1507/endocrj1954.36.253.,Takano K,Endocrinol Jpn,1989,1989/04/01,,,10.1507/endocrj1954.36.253
2266,30666534,Cost Effectiveness of Inhaled Mannitol (Bronchitol(®)) in Patients with Cystic Fibrosis,"Warren E, Morgan K, Toward TJ, Schwenkglenks M, Leadbetter J.",Pharmacoeconomics. 2019 Mar;37(3):435-446. doi: 10.1007/s40273-019-00767-8.,Warren E,Pharmacoeconomics,2019,2019/01/23,,,10.1007/s40273-019-00767-8
2267,37252734,Glycemic Outcomes During Early Use of the MiniMed™ 780G Advanced Hybrid Closed-Loop System with Guardian™ 4 Sensor,"Cordero TL, Dai Z, Arrieta A, Niu F, Vella M, Shin J, Rhinehart AS, McVean J, Lee SW, Slover RH, Forlenza GP, Shulman DI, Pop-Busui R, Thrasher JR, Kipnes MS, Christiansen MP, Buckingham BA, Pihoker C, Sherr JL, Kaiserman KB, Vigersky RA.",Diabetes Technol Ther. 2023 Sep;25(9):652-658. doi: 10.1089/dia.2023.0123. Epub 2023 Jun 16.,Cordero TL,Diabetes Technol Ther,2023,2023/05/30,PMC10460682,,10.1089/dia.2023.0123
2268,30359102,Sugar-Sweetened Beverage Attitudes and Consumption During the First 1000 Days of Life,"Woo Baidal JA, Morel K, Nichols K, Elbel E, Charles N, Goldsmith J, Chen L, Taveras E.",Am J Public Health. 2018 Dec;108(12):1659-1665. doi: 10.2105/AJPH.2018.304691. Epub 2018 Oct 25.,Woo Baidal JA,Am J Public Health,2018,2018/10/26,PMC6236748,,10.2105/AJPH.2018.304691
2269,32072839,Berberine alleviates monosodium glutamate induced postnatal metabolic disorders associated vascular endothelial dysfunction in newborn rats: possible role of matrix metalloproteinase-1,"Abo Zeid AA, Rowida Raafat I, Ahmed AG.",Arch Physiol Biochem. 2022 Jun;128(3):818-829. doi: 10.1080/13813455.2020.1729815. Epub 2020 Feb 19.,Abo Zeid AA,Arch Physiol Biochem,2022,2020/02/20,,,10.1080/13813455.2020.1729815
2270,38364964,"Traditional Pediatric Massage Enhanced Hippocampal GR, BDNF and IGF-1 Expressions and Exerted an Anti-depressant Effect in an Adolescent Rat Model of CUMS-induced Depression","Wu R, Xiong Y, Gu Y, Cao LY, Zhang SY, Song ZX, Fan P, Lin L.",Neuroscience. 2024 Mar 26;542:47-58. doi: 10.1016/j.neuroscience.2024.01.025. Epub 2024 Feb 15.,Wu R,Neuroscience,2024,2024/02/16,,,10.1016/j.neuroscience.2024.01.025
2271,7690363,Effects of maturational stage on insulin sensitivity during puberty,"Cook JS, Hoffman RP, Stene MA, Hansen JR.",J Clin Endocrinol Metab. 1993 Sep;77(3):725-30. doi: 10.1210/jcem.77.3.7690363.,Cook JS,J Clin Endocrinol Metab,1993,1993/09/01,,,10.1210/jcem.77.3.7690363
2272,34195468,Design and strategies used for recruitment and retention in a double blind randomized controlled trial investigating the effects of soluble corn fiber on bone indices in pre-adolescent children (PREBONE-Kids study) in Malaysia,"Arasu K, Chang CY, Wong SY, Ong SH, Yang WY, Chong MHZ, Mavinkurve M, Khoo EJ, Chinna K, Weaver CM, Chee WSS.",Contemp Clin Trials Commun. 2021 Jun 17;22:100801. doi: 10.1016/j.conctc.2021.100801. eCollection 2021 Jun.,Arasu K,Contemp Clin Trials Commun,2021,2021/07/01,PMC8233130,,10.1016/j.conctc.2021.100801
2273,30714351,Overall cognitive profiles in patients with GLUT1 Deficiency Syndrome,"De Giorgis V, Masnada S, Varesio C, Chiappedi MA, Zanaboni M, Pasca L, Filippini M, Macasaet JA, Valente M, Ferraris C, Tagliabue A, Veggiotti P.",Brain Behav. 2019 Mar;9(3):e01224. doi: 10.1002/brb3.1224. Epub 2019 Feb 4.,De Giorgis V,Brain Behav,2019,2019/02/05,PMC6422708,,10.1002/brb3.1224
2274,3116451,Cerebral perfusion pressure: a hemodynamic mechanism of mannitol and the postmannitol hemogram,"Rosner MJ, Coley I.",Neurosurgery. 1987 Aug;21(2):147-56. doi: 10.1227/00006123-198708000-00003.,Rosner MJ,Neurosurgery,1987,1987/08/01,,,10.1227/00006123-198708000-00003
2275,37030530,Screening strategies for glucose tolerance abnormalities and diabetes in people with cystic fibrosis,"Weiss L, Reix P, Mosnier-Pudar H, Ronsin O, Beltrand J, Reynaud Q, Mely L, Burgel PR, Stremler N, Rakotoarisoa L, Galderisi A, Perge K, Bendelac N, Abely M, Kessler L.",Diabetes Metab. 2023 May;49(3):101444. doi: 10.1016/j.diabet.2023.101444. Epub 2023 Apr 6.,Weiss L,Diabetes Metab,2023,2023/04/08,,,10.1016/j.diabet.2023.101444
2276,17090987,"[Causes, diagnosis, and treatment of hypoglycemia]","Adukauskiene D, Blauzdyte J.",Medicina (Kaunas). 2006;42(10):860-7.,Adukauskiene D,Medicina (Kaunas),2006,2006/11/09,,,
2277,25084607,An open-label study examining the effect of pharmacological treatment on mannitol- and exercise-induced airway hyperresponsiveness in asthmatic children and adolescents with exercise-induced bronchoconstriction,"Schafroth Török S, Mueller T, Miedinger D, Jochmann A, Zellweger LJ, Sauter S, Goll A, Chhajed PN, Taegtmeyer AB, Knöpfli B, Leuppi JD.",BMC Pediatr. 2014 Aug 2;14:196. doi: 10.1186/1471-2431-14-196.,Schafroth Török S,BMC Pediatr,2014,2014/08/03,PMC4136947,,10.1186/1471-2431-14-196
2278,38600539,Assessing the clinical diagnostic value of anti-Müllerian hormone in polycystic ovarian syndrome and its correlation with clinical and metabolism indicators,"Wang L, Luo M, Yu X, Li R, Ye F, Xiong D, Gong Y, Zheng M, Liu W, Zeng J.",J Ovarian Res. 2024 Apr 10;17(1):78. doi: 10.1186/s13048-024-01405-4.,Wang L,J Ovarian Res,2024,2024/04/10,PMC11005241,,10.1186/s13048-024-01405-4
2279,28690177,"Reply to: ""Fructose, uric acid and zonal differences in NASH""","Nobili V, Mosca A, Scorletti E, Byrne CD.",J Hepatol. 2017 Nov;67(5):1118-1119. doi: 10.1016/j.jhep.2017.06.031. Epub 2017 Jul 8.,Nobili V,J Hepatol,2017,2017/07/11,,,10.1016/j.jhep.2017.06.031
2280,18337060,Iodine deficiency in pregnant women residing in an area with adequate iodine intake,"Marchioni E, Fumarola A, Calvanese A, Piccirilli F, Tommasi V, Cugini P, Ulisse S, Rossi Fanelli F, D'Armiento M.",Nutrition. 2008 May;24(5):458-61. doi: 10.1016/j.nut.2008.01.015. Epub 2008 Mar 12.,Marchioni E,Nutrition,2008,2008/03/14,,,10.1016/j.nut.2008.01.015
2281,24096259,Prevalence and factors related to urinary albumin excretion in obese youths,"Lurbe E, Torro MI, Alvarez J, Aguilar F, Fernandez-Formoso JA, Redon J.",J Hypertens. 2013 Nov;31(11):2230-6; discussion 2236. doi: 10.1097/HJH.0b013e328364bcbf.,Lurbe E,J Hypertens,2013,2013/10/08,,,10.1097/HJH.0b013e328364bcbf
2282,32728891,Metformin improves blood glucose by increasing incretins independent of changes in gluconeogenesis in youth with type 2 diabetes,"Cravalho CKL, Meyers AG, Mabundo LS, Courville A, Yang S, Cai H, Dai Y, Walter M, Walter PJ, Sharma S, Chacko S, Cogen F, Magge SN, Haymond MW, Chung ST.",Diabetologia. 2020 Oct;63(10):2194-2204. doi: 10.1007/s00125-020-05236-y. Epub 2020 Jul 29.,Cravalho CKL,Diabetologia,2020,2020/07/31,,,10.1007/s00125-020-05236-y
2283,39127139,Assessment of urine metabolite biomarkers for the detection of S. haematobium infection in pre-school aged children in a rural community in Zimbabwe,"Midzi H, Naicker T, Vengesai A, Mabaya L, Muchesa P, Mduluza-Jokonya TL, Katerere AG, Kapanga D, Kasambala M, Mutapi F, Mduluza T.",Acta Trop. 2024 Oct;258:107327. doi: 10.1016/j.actatropica.2024.107327. Epub 2024 Aug 8.,Midzi H,Acta Trop,2024,2024/08/10,,,10.1016/j.actatropica.2024.107327
2284,12481947,Goiter prevalence and urinary iodide excretion in a formerly iodine-deficient region after introduction of statutory lodization of common salt,"Heinisch M, Kumnig G, Asböck D, Mikosch P, Gallowitsch HJ, Kresnik E, Gomez I, Unterweger O, Lind P.",Thyroid. 2002 Sep;12(9):809-14. doi: 10.1089/105072502760339389.,Heinisch M,Thyroid,2002,2002/12/17,,,10.1089/105072502760339389
2285,31564602,E-Hookah Versus E-Cigarettes: Findings From Wave 2 of the PATH Study (2014-2015),"Rezk-Hanna M, Toyama J, Ikharo E, Brecht ML, Benowitz NL.",Am J Prev Med. 2019 Nov;57(5):e163-e173. doi: 10.1016/j.amepre.2019.05.007. Epub 2019 Sep 27.,Rezk-Hanna M,Am J Prev Med,2019,2019/10/01,,,10.1016/j.amepre.2019.05.007
2286,9870469,Insulin resistance precedes microalbuminuria in patients with insulin-dependent diabetes mellitus,"Ekstrand AV, Groop PH, Grönhagen-Riska C.",Nephrol Dial Transplant. 1998 Dec;13(12):3079-83. doi: 10.1093/ndt/13.12.3079.,Ekstrand AV,Nephrol Dial Transplant,1998,1998/12/31,,,10.1093/ndt/13.12.3079
2287,29389666,Metabolic features and changes in glucose-induced serum glucagon-like peptide-1 levels in children with hypothalamic obesity,"Chai-Udom R, Aroonparkmongkol S, Sahakitrungruang T.",J Pediatr Endocrinol Metab. 2020 Mar 26;33(3):331-337. doi: 10.1515/jpem-2017-0350.,Chai-Udom R,J Pediatr Endocrinol Metab,2020,2018/02/02,,,10.1515/jpem-2017-0350
2288,33547409,Does a lower interventional glucose threshold affect neurodevelopment in at-risk neonates?,"McGann C, Coggins SA, Dysart K.",J Perinatol. 2021 May;41(5):1180-1183. doi: 10.1038/s41372-021-00921-1. Epub 2021 Feb 5.,McGann C,J Perinatol,2021,2021/02/06,,,10.1038/s41372-021-00921-1
2289,38068806,The Association between Glucose 6-Phosphate Dehydrogenase Deficiency and Attention Deficit/Hyperactivity Disorder,"Merzon E, Magen E, Ashkenazi S, Weizman A, Manor I, Krone B, Green I, Golan-Cohen A, Vinker S, Faraone SV, Israel A.",Nutrients. 2023 Nov 29;15(23):4948. doi: 10.3390/nu15234948.,Merzon E,Nutrients,2023,2023/12/09,PMC10708268,,10.3390/nu15234948
