,PMID,Title,Authors,Citation,First Author,Journal/Book,Publication Year,Create Date,PMCID,NIHMS ID,DOI
2726,15334626,The plasma pharmacokinetics and cerebral spinal fluid penetration of intravenous topiramate in newborn pigs,"Galinkin JL, Kurth CD, Shi H, Priestley MA, Loepke AW, Adamson PC.",Biopharm Drug Dispos. 2004 Sep;25(6):265-71. doi: 10.1002/bdd.408.,Galinkin JL,Biopharm Drug Dispos,2004,2004/08/31,,,10.1002/bdd.408
2727,32626722,Overuse of Non-caloric Sweeteners in Foods and Beverages in Chile: A Threat to Consumers' Free Choice?,"Sambra V, López-Arana S, Cáceres P, Abrigo K, Collinao J, Espinoza A, Valenzuela S, Carvajal B, Prado G, Peralta R, Gotteland M.",Front Nutr. 2020 Jun 17;7:68. doi: 10.3389/fnut.2020.00068. eCollection 2020.,Sambra V,Front Nutr,2020,2020/07/07,PMC7311776,,10.3389/fnut.2020.00068
2728,30350765,Unsafe Drinking Water Is Associated with Environmental Enteric Dysfunction and Poor Growth Outcomes in Young Children in Rural Southwestern Uganda,"Lauer JM, Duggan CP, Ausman LM, Griffiths JK, Webb P, Bashaasha B, Agaba E, Turyashemererwa FM, Ghosh S.",Am J Trop Med Hyg. 2018 Dec;99(6):1606-1612. doi: 10.4269/ajtmh.18-0143.,Lauer JM,Am J Trop Med Hyg,2018,2018/10/24,PMC6283503,,10.4269/ajtmh.18-0143
2729,25037326,Branch pattern of starch internal structure influences the glucogenesis by mucosal Nt-maltase-glucoamylase,"Lin AH, Ao Z, Quezada-Calvillo R, Nichols BL, Lin CT, Hamaker BR.",Carbohydr Polym. 2014 Oct 13;111:33-40. doi: 10.1016/j.carbpol.2014.04.027. Epub 2014 Apr 22.,Lin AH,Carbohydr Polym,2014,2014/07/20,,,10.1016/j.carbpol.2014.04.027
2730,38220116,Associations of diet quality and daily free sugar intake with depressive and anxiety symptoms among Chinese adolescents,"Xie X, Li Y, Zhang Y, Lin X, Huang M, Fu H, Ma Y, Chen R, Wang X, Tang J.",J Affect Disord. 2024 Apr 1;350:550-558. doi: 10.1016/j.jad.2024.01.101. Epub 2024 Jan 14.,Xie X,J Affect Disord,2024,2024/01/14,,,10.1016/j.jad.2024.01.101
2731,24496178,The pentose phosphate pathway and pyruvate carboxylation after neonatal hypoxic-ischemic brain injury,"Brekke EM, Morken TS, Widerøe M, Håberg AK, Brubakk AM, Sonnewald U.",J Cereb Blood Flow Metab. 2014 Apr;34(4):724-34. doi: 10.1038/jcbfm.2014.8. Epub 2014 Feb 5.,Brekke EM,J Cereb Blood Flow Metab,2014,2014/02/06,PMC3982102,,10.1038/jcbfm.2014.8
2732,27874076,Oligofructose as an adjunct in treatment of diabetes in NOD mice,"Chan C, Hyslop CM, Shrivastava V, Ochoa A, Reimer RA, Huang C.",Sci Rep. 2016 Nov 22;6:37627. doi: 10.1038/srep37627.,Chan C,Sci Rep,2016,2016/11/23,PMC5118692,,10.1038/srep37627
2733,30707603,The Effect of Deep Freezing on Human Milk Macronutrients Content,"Orbach R, Mandel D, Mangel L, Marom R, Lubetzky R.",Breastfeed Med. 2019 Apr;14(3):172-176. doi: 10.1089/bfm.2018.0226. Epub 2019 Feb 1.,Orbach R,Breastfeed Med,2019,2019/02/02,,,10.1089/bfm.2018.0226
2734,31085717,Long non-coding RNA MEG3 serves as a ceRNA for microRNA-145 to induce apoptosis of AC16 cardiomyocytes under high glucose condition,"Chen Y, Zhang Z, Zhu D, Zhao W, Li F.",Biosci Rep. 2019 Jun 7;39(6):BSR20190444. doi: 10.1042/BSR20190444. Print 2019 Jun 28.,Chen Y,Biosci Rep,2019,2019/05/16,PMC6554216,,10.1042/BSR20190444
2735,37799346,Flavor of Iron at EHA2023: Novel Regulatory Mechanisms and Therapeutic Options for the Correction of Anemia,"Vinchi F, Asperti M, Marques O, Nai A, Silvestri L.",Hemasphere. 2023 Oct 3;7(10):e955. doi: 10.1097/HS9.0000000000000955. eCollection 2023 Oct.,Vinchi F,Hemasphere,2023,2023/10/06,PMC10550016,,10.1097/HS9.0000000000000955
2736,33984575,"Environmental exposure to perfluoroalkyl substances in early pregnancy, maternal glucose homeostasis and the risk of gestational diabetes: A prospective cohort study","Yu G, Jin M, Huang Y, Aimuzi R, Zheng T, Nian M, Tian Y, Wang W, Luo Z, Shen L, Wang X, Du Q, Xu W, Zhang J; Shanghai Birth Cohort Study.",Environ Int. 2021 Nov;156:106621. doi: 10.1016/j.envint.2021.106621. Epub 2021 May 11.,Yu G,Environ Int,2021,2021/05/13,,,10.1016/j.envint.2021.106621
2737,37342890,Suppressed vascular Rho-kinase activation is a protective cardiovascular mechanism in obese female mice,"Barbosa GS, Costa RM, Awata WMC, Singh S, Alves JV, Bruder-Nascimento A, Corrêa CR, Bruder-Nascimento T.",Biosci Rep. 2023 Jul 26;43(7):BSR20230672. doi: 10.1042/BSR20230672.,Barbosa GS,Biosci Rep,2023,2023/06/21,PMC10352127,,10.1042/BSR20230672
2738,36480317,"Hypertonic saline use in neurocritical care for treating cerebral edema: A review of optimal formulation, dosing, safety, administration and storage","Holden DN, Mucksavage JJ, Cokley JA, Kim KS, Tucker NL, Esordi MS, Cook AM.",Am J Health Syst Pharm. 2023 Mar 7;80(6):331-342. doi: 10.1093/ajhp/zxac368.,Holden DN,Am J Health Syst Pharm,2023,2022/12/08,,,10.1093/ajhp/zxac368
2739,36214191,Cerebrospinal fluid characteristics of patients treated with intrathecal nusinersen for spinal muscular atrophy,"Orbach R, Sagi L, Sadot E, Tokatly Latzer I, Shtamler A, Zisberg T, Fattal-Valevski A.",Muscle Nerve. 2022 Dec;66(6):762-766. doi: 10.1002/mus.27731. Epub 2022 Oct 19.,Orbach R,Muscle Nerve,2022,2022/10/10,PMC9828332,,10.1002/mus.27731
2740,38575153,Characterization of the zebrafish as a model of ATP-sensitive potassium channel hyperinsulinism,"Juliana CA, Benjet J, De Leon DD.",BMJ Open Diabetes Res Care. 2024 Apr 4;12(2):e003735. doi: 10.1136/bmjdrc-2023-003735.,Juliana CA,BMJ Open Diabetes Res Care,2024,2024/04/04,PMC11005463,,10.1136/bmjdrc-2023-003735
2741,27437069,Identification of Redox and Glucose-Dependent Txnip Protein Interactions,"Forred BJ, Neuharth S, Kim DI, Amolins MW, Motamedchaboki K, Roux KJ, Vitiello PF.",Oxid Med Cell Longev. 2016;2016:5829063. doi: 10.1155/2016/5829063. Epub 2016 Jun 29.,Forred BJ,Oxid Med Cell Longev,2016,2016/07/21,PMC4942636,,10.1155/2016/5829063
2742,36646053,Five-Year Therapy with Recombinant Human Insulin-Like Growth Factor-1 in a Patient with PAPP-A2 Deficiency,"Muthuvel G, Dauber A, Alexandrou E, Tyzinski L, Andrew M, Hwa V, Backeljauw P.",Horm Res Paediatr. 2023;96(5):449-457. doi: 10.1159/000529071. Epub 2023 Jan 16.,Muthuvel G,Horm Res Paediatr,2023,2023/01/16,,,10.1159/000529071
2743,31100804,Assessing the Potential for Integrating Routine Data Collection on Complementary Feeding to Child Health Visits: A Mixed-Methods Study,"Tully L, Wright CM, McCormick D, Garcia AL.",Int J Environ Res Public Health. 2019 May 16;16(10):1722. doi: 10.3390/ijerph16101722.,Tully L,Int J Environ Res Public Health,2019,2019/05/19,PMC6571620,,10.3390/ijerph16101722
2744,2718696,D-glucose uptake is increased in jejunal brush-border membrane vesicles from hyperthyroid chicks,"Debiec H, Cross HS, Peterlik M.",Acta Endocrinol (Copenh). 1989 Apr;120(4):435-41. doi: 10.1530/acta.0.1200435.,Debiec H,Acta Endocrinol (Copenh),1989,1989/04/01,,,10.1530/acta.0.1200435
2745,3345309,Influence of lactose on phosphate metabolism in rats,"Debiec H, Lorenc R.",Br J Nutr. 1988 Jan;59(1):87-92. doi: 10.1079/bjn19880013.,Debiec H,Br J Nutr,1988,1988/01/01,,,10.1079/bjn19880013
2746,29465310,Dietary starch breakdown product sensing mobilizes and apically activates α-glucosidases in small intestinal enterocytes,"Chegeni M, Amiri M, Nichols BL, Naim HY, Hamaker BR.",FASEB J. 2018 Jul;32(7):3903-3911. doi: 10.1096/fj.201701029R. Epub 2018 Feb 20.,Chegeni M,FASEB J,2018,2018/02/22,,,10.1096/fj.201701029R
2747,37838514,Tick salivary glycans - a sugar-coated tick bite,"Karim S, Leyva-Castillo JM, Narasimhan S.",Trends Parasitol. 2023 Dec;39(12):1100-1113. doi: 10.1016/j.pt.2023.09.012. Epub 2023 Oct 12.,Karim S,Trends Parasitol,2023,2023/10/14,,,10.1016/j.pt.2023.09.012
2748,11788663,Hexoneogenesis in the human breast during lactation,"Sunehag AL, Louie K, Bier JL, Tigas S, Haymond MW.",J Clin Endocrinol Metab. 2002 Jan;87(1):297-301. doi: 10.1210/jcem.87.1.8171.,Sunehag AL,J Clin Endocrinol Metab,2002,2002/01/15,,,10.1210/jcem.87.1.8171
2749,27154494,Identification of glutathione and related cysteine conjugates derived from reactive metabolites of methyleugenol in rats,"Yao H, Peng Y, Zheng J.",Chem Biol Interact. 2016 Jun 25;253:143-52. doi: 10.1016/j.cbi.2016.05.006. Epub 2016 May 3.,Yao H,Chem Biol Interact,2016,2016/05/08,,,10.1016/j.cbi.2016.05.006
2750,25052323,Altered astrocyte-neuronal interactions after hypoxia-ischemia in the neonatal brain in female and male rats,"Morken TS, Brekke E, Håberg A, Widerøe M, Brubakk AM, Sonnewald U.",Stroke. 2014 Sep;45(9):2777-85. doi: 10.1161/STROKEAHA.114.005341. Epub 2014 Jul 22.,Morken TS,Stroke,2014,2014/07/24,,,10.1161/STROKEAHA.114.005341
2751,26144888,The prebiotics 3'Sialyllactose and 6'Sialyllactose diminish stressor-induced anxiety-like behavior and colonic microbiota alterations: Evidence for effects on the gut-brain axis,"Tarr AJ, Galley JD, Fisher SE, Chichlowski M, Berg BM, Bailey MT.",Brain Behav Immun. 2015 Nov;50:166-177. doi: 10.1016/j.bbi.2015.06.025. Epub 2015 Jul 2.,Tarr AJ,Brain Behav Immun,2015,2015/07/07,PMC4631662,NIHMS707485,10.1016/j.bbi.2015.06.025
2752,24949970,The diabetes susceptibility gene Clec16a regulates mitophagy,"Soleimanpour SA, Gupta A, Bakay M, Ferrari AM, Groff DN, Fadista J, Spruce LA, Kushner JA, Groop L, Seeholzer SH, Kaufman BA, Hakonarson H, Stoffers DA.",Cell. 2014 Jun 19;157(7):1577-90. doi: 10.1016/j.cell.2014.05.016.,Soleimanpour SA,Cell,2014,2014/06/21,PMC4184276,NIHMS600455,10.1016/j.cell.2014.05.016
2753,36673682,Which Is the Most Appropriate Cut-Off of HbA1c for Prediabetes Screening in Caucasian Youths with Overweight or Obesity?,"Di Bonito P, Licenziati MR, Corica D, Wasniewska M, Di Sessa A, Miraglia Del Giudice E, Morandi A, Maffeis C, Faienza MF, Mozzillo E, Calcaterra V, Franco F, Maltoni G, Valerio G.",Int J Environ Res Public Health. 2023 Jan 4;20(2):928. doi: 10.3390/ijerph20020928.,Di Bonito P,Int J Environ Res Public Health,2023,2023/01/21,PMC9858643,,10.3390/ijerph20020928
2754,35850197,Altered Gut Microbiome Composition and Function Are Associated With Gut Barrier Dysfunction in Healthy Relatives of Patients With Crohn's Disease,"Leibovitzh H, Lee SH, Xue M, Raygoza Garay JA, Hernandez-Rocha C, Madsen KL, Meddings JB, Guttman DS, Espin-Garcia O, Smith MI, Goethel A, Griffiths AM, Moayyedi P, Steinhart AH, Panaccione R, Huynh HQ, Jacobson K, Aumais G, Mack DR, Abreu MT, Bernstein CN, Marshall JK, Turner D, Xu W; CCC GEM Project Research Consortium; Turpin W, Croitoru K.",Gastroenterology. 2022 Nov;163(5):1364-1376.e10. doi: 10.1053/j.gastro.2022.07.004. Epub 2022 Jul 16.,Leibovitzh H,Gastroenterology,2022,2022/07/19,,,10.1053/j.gastro.2022.07.004
2755,27288754,"Panax notoginseng saponins provide neuroprotection by regulating NgR1/RhoA/ROCK2 pathway expression, in vitro and in vivo","Shi X, Yu W, Yang T, Liu W, Zhao Y, Sun Y, Chai L, Gao Y, Dong B, Zhu L.",J Ethnopharmacol. 2016 Aug 22;190:301-12. doi: 10.1016/j.jep.2016.06.017. Epub 2016 Jun 8.,Shi X,J Ethnopharmacol,2016,2016/06/12,,,10.1016/j.jep.2016.06.017
2756,39307208,"A mathematical multiple-dimensional strategy for Q-markers identification based on ""five principles"": Tianshu Capsule for migraine treatment as an example","Gu X, Li Z, Feng Y, Hu Y, Xie K, Shang J, Ma C, Ju W, Zou J, Xu M.",J Ethnopharmacol. 2024 Sep 21;337(Pt 1):118848. doi: 10.1016/j.jep.2024.118848. Online ahead of print.,Gu X,J Ethnopharmacol,2024,2024/09/22,,,10.1016/j.jep.2024.118848
2757,37166980,Short-term fasting lowers glucagon levels under euglycemic and hypoglycemic conditions in healthy humans,"Warner SO, Dai Y, Sheanon N, Yao MV, Cason RL, Arbabi S, Patel SB, Lindquist D, Winnick JJ.",JCI Insight. 2023 Jun 22;8(12):e169789. doi: 10.1172/jci.insight.169789.,Warner SO,JCI Insight,2023,2023/05/11,PMC10371233,,10.1172/jci.insight.169789
2758,32325173,Maternal exposure to Δ9-tetrahydrocannabinol impairs female offspring glucose homeostasis and endocrine pancreatic development in the rat,"Gillies R, Lee K, Vanin S, Laviolette SR, Holloway AC, Arany E, Hardy DB.",Reprod Toxicol. 2020 Jun;94:84-91. doi: 10.1016/j.reprotox.2020.04.070. Epub 2020 Apr 20.,Gillies R,Reprod Toxicol,2020,2020/04/24,,,10.1016/j.reprotox.2020.04.070
2759,27697197,A Patient With Alcoholic Ketoacidosis and Profound Lactemia,"Gerrity RS, Pizon AF, King AM, Katz KD, Menke NB.",J Emerg Med. 2016 Oct;51(4):447-449. doi: 10.1016/j.jemermed.2015.05.048.,Gerrity RS,J Emerg Med,2016,2016/10/05,,,10.1016/j.jemermed.2015.05.048
2760,29965973,Long-term metabolic effects of malnutrition: Liver steatosis and insulin resistance following early-life protein restriction,"Dalvi PS, Yang S, Swain N, Kim J, Saha S, Bourdon C, Zhang L, Chami R, Bandsma RHJ.",PLoS One. 2018 Jul 2;13(7):e0199916. doi: 10.1371/journal.pone.0199916. eCollection 2018.,Dalvi PS,PLoS One,2018,2018/07/03,PMC6028108,,10.1371/journal.pone.0199916
2761,37326269,Assessment of glucose homeostasis in young adult female β-thalassemia major patients (β-TM) with acquired hypogonadotropic hypogonadism (AHH) never treated with sex steroids compared to eugonadal β-TM patients with spontaneous menstrual cycles,"De Sanctis V, Daar S, Soliman AT, Tzoulis P, Di Maio S, Kattamis C.",Acta Biomed. 2023 Jun 14;94(3):e2023065. doi: 10.23750/abm.v94i3.14147.,De Sanctis V,Acta Biomed,2023,2023/06/16,PMC10308476,,10.23750/abm.v94i3.14147
2762,33218355,Insulin regulation of solute carrier family 2 member 1 (glucose transporter 1) expression and glucose uptake in decidualizing human endometrial stromal cells: an in vitro study,"Jakson I, Ujvari D, Brusell Gidlöf S, Lindén Hirschberg A.",Reprod Biol Endocrinol. 2020 Nov 21;18(1):117. doi: 10.1186/s12958-020-00674-0.,Jakson I,Reprod Biol Endocrinol,2020,2020/11/21,PMC7679983,,10.1186/s12958-020-00674-0
2763,27480812,Contribution of the Individual Small Intestinal α-Glucosidases to Digestion of Unusual α-Linked Glycemic Disaccharides,"Lee BH, Rose DR, Lin AH, Quezada-Calvillo R, Nichols BL, Hamaker BR.",J Agric Food Chem. 2016 Aug 24;64(33):6487-94. doi: 10.1021/acs.jafc.6b01816. Epub 2016 Aug 9.,Lee BH,J Agric Food Chem,2016,2016/08/03,,,10.1021/acs.jafc.6b01816
2764,16972325,Inhibitive effects of anti-oxidative vitamins on mannitol-induced apoptosis of vascular endothelial cells,"Pan KY, Shen MP, Ye ZH, Dai XN, Shang SQ.",J Zhejiang Univ Sci B. 2006 Oct;7(10):825-9. doi: 10.1631/jzus.2006.B0825.,Pan KY,J Zhejiang Univ Sci B,2006,2006/09/15,PMC1599808,,10.1631/jzus.2006.B0825
2765,31948940,"A Feedback Circuitry between Polycomb Signaling and Fructose-1, 6-Bisphosphatase Enables Hepatic and Renal Tumorigenesis","Liao K, Deng S, Xu L, Pan W, Yang S, Zheng F, Wu X, Hu H, Liu Z, Luo J, Zhang R, Kuang DM, Dong J, Wu Y, Zhang H, Zhou P, Bei JX, Xu Y, Ji Y, Wang P, Ju HQ, Xu RH, Li B.",Cancer Res. 2020 Feb 15;80(4):675-688. doi: 10.1158/0008-5472.CAN-19-2060. Epub 2020 Jan 16.,Liao K,Cancer Res,2020,2020/01/18,,,10.1158/0008-5472.CAN-19-2060
2766,39182820,Evaluation of aspartame effects at environmental concentration on early development of zebrafish: Morphology and transcriptome(1),"Wu Y, Lin Z, Chen F, Zhang X, Liu Y, Sun H.",Environ Pollut. 2024 Nov 15;361:124792. doi: 10.1016/j.envpol.2024.124792. Epub 2024 Aug 23.,Wu Y,Environ Pollut,2024,2024/08/25,,,10.1016/j.envpol.2024.124792
2767,33552167,Vaping and Mental Health,Patten SB.,J Can Acad Child Adolesc Psychiatry. 2021 Feb;30(1):3-5. Epub 2021 Feb 1.,Patten SB,J Can Acad Child Adolesc Psychiatry,2021,2021/02/08,PMC7837520,,
2768,26596520,Altered sensitization patterns to sweet food stimuli in patients recovered from anorexia and bulimia nervosa,"Wagner A, Simmons AN, Oberndorfer TA, Frank GK, McCurdy-McKinnon D, Fudge JL, Yang TT, Paulus MP, Kaye WH.",Psychiatry Res. 2015 Dec 30;234(3):305-13. doi: 10.1016/j.pscychresns.2015.10.010. Epub 2015 Nov 10.,Wagner A,Psychiatry Res,2015,2015/11/25,PMC6547368,NIHMS740026,10.1016/j.pscychresns.2015.10.010
2769,32644139,Association of Major Food Sources of Fructose-Containing Sugars With Incident Metabolic Syndrome: A Systematic Review and Meta-analysis,"Semnani-Azad Z, Khan TA, Blanco Mejia S, de Souza RJ, Leiter LA, Kendall CWC, Hanley AJ, Sievenpiper JL.",JAMA Netw Open. 2020 Jul 1;3(7):e209993. doi: 10.1001/jamanetworkopen.2020.9993.,Semnani-Azad Z,JAMA Netw Open,2020,2020/07/10,PMC7348689,,10.1001/jamanetworkopen.2020.9993
2770,1900648,Commentary on the safety of red cells preserved in extended-storage media for neonatal transfusions,"Luban NL, Strauss RG, Hume HA.",Transfusion. 1991 Mar-Apr;31(3):229-35. doi: 10.1046/j.1537-2995.1991.31391165172.x.,Luban NL,Transfusion,1991,1991/03/01,,,10.1046/j.1537-2995.1991.31391165172.x
2771,36212970,Effect of Antioxidant-Rich Moringa Leaves on Quality and Functional Properties of Strawberry Juice,"Arif MA, Inam-Ur-Raheem M, Khalid W, Lima CMG, Jha RP, Khalid MZ, Santana RF, Sharma R, Alhasaniah AH, Emran TB.",Evid Based Complement Alternat Med. 2022 Sep 30;2022:8563982. doi: 10.1155/2022/8563982. eCollection 2022.,Arif MA,Evid Based Complement Alternat Med,2022,2022/10/10,PMC9546718,,10.1155/2022/8563982
2772,36075181,Laurolitsine ameliorates type 2 diabetes by regulating the hepatic LKB1-AMPK pathway and gut microbiota,"Yong Z, Ruiqi W, Yanan Y, Ning M, Zhi Z, Yinfeng T, Lin D, Yiying L, Weiying L, Chongming W, Xiaopo Z.",Phytomedicine. 2022 Nov;106:154423. doi: 10.1016/j.phymed.2022.154423. Epub 2022 Aug 31.,Yong Z,Phytomedicine,2022,2022/09/08,,,10.1016/j.phymed.2022.154423
2773,33574981,Apelin/APJ-Manipulated CaMKK/AMPK/GSK3β Signaling Works as an Endogenous Counterinjury Mechanism in Promoting the Vitality of Random-Pattern Skin Flaps,"Lou ZL, Zhang CX, Li JF, Chen RH, Wu WJ, Hu XF, Shi HC, Gao WY, Zhao QF.",Oxid Med Cell Longev. 2021 Jan 25;2021:8836058. doi: 10.1155/2021/8836058. eCollection 2021.,Lou ZL,Oxid Med Cell Longev,2021,2021/02/12,PMC7857910,,10.1155/2021/8836058
2774,38367905,Patient and Provider Factors Associated With Initiating Sodium-Glucose Cotransporter-2 Inhibitors (SGTL2is) Following FDA Approval for Heart Failure With Preserved and Mildly Reduced Ejection Fraction,"Martyn T, Saef J, Bansal A, Martinez KA, Block-Beach H, Hohman J, Kapadia SR, Desai MY, Estep JD, Albert NM, Starling RC, Tang WHW.",J Card Fail. 2024 Apr;30(4):630-632. doi: 10.1016/j.cardfail.2024.01.006. Epub 2024 Feb 16.,Martyn T,J Card Fail,2024,2024/02/17,,,10.1016/j.cardfail.2024.01.006
2775,31504661,Enteroendocrine Regulation of Nutrient Absorption,McCauley HA.,J Nutr. 2020 Jan 1;150(1):10-21. doi: 10.1093/jn/nxz191.,McCauley HA,J Nutr,2020,2019/09/11,,,10.1093/jn/nxz191
2776,12595591,Zinc as a potential enteroprotector in oral rehydration solutions: its role in nitric oxide metabolism,"Wingertzahn MA, Rehman KU, Altaf W, Wapnir RA.",Pediatr Res. 2003 Mar;53(3):434-9. doi: 10.1203/01.PDR.0000049465.73687.4D.,Wingertzahn MA,Pediatr Res,2003,2003/02/22,,,10.1203/01.PDR.0000049465.73687.4D
2777,37171118,Hypertonic glucose pleurodesis for preterm neonates with chylothorax,"Hon KLE, Hui CMP, Fung GPG, Leung KKY, Yung TC.",Pediatr Pulmonol. 2023 Jul;58(7):2145-2150. doi: 10.1002/ppul.26436. Epub 2023 May 12.,Hon KLE,Pediatr Pulmonol,2023,2023/05/12,,,10.1002/ppul.26436
2778,8048699,Feasibility of invasive monitoring of intracranial pressure in term neonates,"Shankaran S, Woldt E, Bedard MP, Delaney-Black V, Zakalik K, Canady A.",Brain Dev. 1994 Mar-Apr;16(2):121-5. doi: 10.1016/0387-7604(94)90047-7.,Shankaran S,Brain Dev,1994,1994/03/01,,,10.1016/0387-7604(94)90047-7
2779,24441088,Individualizing fortification of human milk using real time human milk analysis,"Radmacher PG, Lewis SL, Adamkin DH.",J Neonatal Perinatal Med. 2013 Jan 1;6(4):319-23. doi: 10.3233/NPM-1373113.,Radmacher PG,J Neonatal Perinatal Med,2013,2014/01/21,,,10.3233/NPM-1373113
2780,2288995,Intestinal permeability to intact lactose in newborns and adults,"Bezerra JA, Thompson SH, Morse M, Koldovský O, Udall JN Jr.",Biol Neonate. 1990;58(6):334-42. doi: 10.1159/000243288.,Bezerra JA,Biol Neonate,1990,1990/01/01,,,10.1159/000243288
2781,12519857,Contribution of plasma galactose and glucose to milk lactose synthesis during galactose ingestion,"Sunehag A, Tigas S, Haymond MW.",J Clin Endocrinol Metab. 2003 Jan;88(1):225-9. doi: 10.1210/jc.2002-020768.,Sunehag A,J Clin Endocrinol Metab,2003,2003/01/10,,,10.1210/jc.2002-020768
2782,30024975,Potential activities and mechanisms of extracellular polysaccharopeptides from fermented Trametes versicolor on regulating glucose homeostasis in insulin-resistant HepG2 cells,"Teng JF, Lee CH, Hsu TH, Lo HC.",PLoS One. 2018 Jul 19;13(7):e0201131. doi: 10.1371/journal.pone.0201131. eCollection 2018.,Teng JF,PLoS One,2018,2018/07/20,PMC6053205,,10.1371/journal.pone.0201131
2783,35282464,"Continuous Glucose Monitoring in Adolescents With Obesity: Monitoring of Glucose Profiles, Glycemic Excursions, and Adherence to Time Restricted Eating Programs","Naguib MN, Hegedus E, Raymond JK, Goran MI, Salvy SJ, Wee CP, Durazo-Arvizu R, Moss L, Vidmar AP.",Front Endocrinol (Lausanne). 2022 Feb 25;13:841838. doi: 10.3389/fendo.2022.841838. eCollection 2022.,Naguib MN,Front Endocrinol (Lausanne),2022,2022/03/14,PMC8914373,,10.3389/fendo.2022.841838
2784,33096361,Inhibition of PI3K/Akt/NF-κB signaling by Aloin for ameliorating the progression of osteoarthritis: In vitro and in vivo studies,"Zhang C, Shao Z, Hu X, Chen Z, Li B, Jiang R, Bsoul N, Chen J, Xu C, Gao W.",Int Immunopharmacol. 2020 Dec;89(Pt B):107079. doi: 10.1016/j.intimp.2020.107079. Epub 2020 Oct 20.,Zhang C,Int Immunopharmacol,2020,2020/10/23,,,10.1016/j.intimp.2020.107079
2785,34551394,Cx32 inhibits the autophagic effect of Nur77 in SH-SY5Y cells and rat brain with ischemic stroke,"Ping F, Zhang C, Wang X, Wang Y, Zhou D, Hu J, Chen Y, Ling J, Zhou J.",Aging (Albany NY). 2021 Sep 22;13(18):22188-22207. doi: 10.18632/aging.203526. Epub 2021 Sep 22.,Ping F,Aging (Albany NY),2021,2021/09/22,PMC8507301,,10.18632/aging.203526
2786,16041639,Atrial flutter following placement of an umbilical venous catheter,"Sinha A, Fernandes CJ, Kim JJ, Fenrich AL Jr, Enciso J.",Am J Perinatol. 2005 Jul;22(5):275-7. doi: 10.1055/s-2005-870898.,Sinha A,Am J Perinatol,2005,2005/07/26,,,10.1055/s-2005-870898
2787,34030655,The metabolic profile of Bifidobacterium dentium reflects its status as a human gut commensal,"Engevik MA, Danhof HA, Hall A, Engevik KA, Horvath TD, Haidacher SJ, Hoch KM, Endres BT, Bajaj M, Garey KW, Britton RA, Spinler JK, Haag AM, Versalovic J.",BMC Microbiol. 2021 May 24;21(1):154. doi: 10.1186/s12866-021-02166-6.,Engevik MA,BMC Microbiol,2021,2021/05/25,PMC8145834,,10.1186/s12866-021-02166-6
2788,30058707,Ulinastatin inhibits high glucose-induced cardiomyocyte apoptosis through activating Akt signaling,"Long Y, Zhang Y, Cai SS, Sun DM, Li YH.",Eur Rev Med Pharmacol Sci. 2018 Jul;22(14):4691-4697. doi: 10.26355/eurrev_201807_15530.,Long Y,Eur Rev Med Pharmacol Sci,2018,2018/07/31,,,10.26355/eurrev_201807_15530
2789,12576176,Metabolism of brain amino acids following pentylenetetrazole treatment,"Yudkoff M, Daikhin Y, Nissim I, Horyn O, Lazarow A, Nissim I.",Epilepsy Res. 2003 Feb;53(1-2):151-62. doi: 10.1016/s0920-1211(02)00260-7.,Yudkoff M,Epilepsy Res,2003,2003/02/11,,,10.1016/s0920-1211(02)00260-7
2790,34671099,A pilot study on the biochemical effects of repeated administration of 24% oral sucrose vs. 30% oral dextrose on urinary markers of adenosine triphosphate degradation,"Angeles DM, Boskovic DS, Deming D, Hopper A, Peverini R, Czynski A, Hoch E, Phillips R, Tan JB, Camberos V, Bahjri K, Pegis P, Goldstein M, Truong G, Fayard E.",J Perinatol. 2021 Dec;41(12):2761-2765. doi: 10.1038/s41372-021-01239-8. Epub 2021 Oct 20.,Angeles DM,J Perinatol,2021,2021/10/21,,,10.1038/s41372-021-01239-8
2791,38088400,Combining renin-angiotensin system blockade and sodium-glucose cotransporter-2 inhibition in experimental diabetes results in synergistic beneficial effects,"Cruz-López EO, Ye D, Stolk DG, Clahsen-van Groningen MC, van Veghel R, Garrelds IM, Poglitsch M, Domenig O, Alipour Symakani RS, Merkus D, Verdonk K, Jan Danser AH.",J Hypertens. 2024 May 1;42(5):883-892. doi: 10.1097/HJH.0000000000003633. Epub 2023 Dec 8.,Cruz-López EO,J Hypertens,2024,2023/12/13,,,10.1097/HJH.0000000000003633
2792,34781143,Carminic acid mitigates fructose-triggered hepatic steatosis by inhibition of oxidative stress and inflammatory reaction,"Li L, Fang B, Zhang Y, Yan L, He Y, Hu L, Xu Q, Li Q, Dai X, Kuang Q, Xu M, Tan J, Ge C.",Biomed Pharmacother. 2022 Jan;145:112404. doi: 10.1016/j.biopha.2021.112404. Epub 2021 Nov 12.,Li L,Biomed Pharmacother,2022,2021/11/15,,,10.1016/j.biopha.2021.112404
2793,35298903,Protein tyrosine phosphatase receptor δ serves as the orexigenic asprosin receptor,"Mishra I, Xie WR, Bournat JC, He Y, Wang C, Silva ES, Liu H, Ku Z, Chen Y, Erokwu BO, Jia P, Zhao Z, An Z, Flask CA, He Y, Xu Y, Chopra AR.",Cell Metab. 2022 Apr 5;34(4):549-563.e8. doi: 10.1016/j.cmet.2022.02.012. Epub 2022 Mar 16.,Mishra I,Cell Metab,2022,2022/03/17,PMC8986618,NIHMS1786674,10.1016/j.cmet.2022.02.012
2794,37628941,Expression Levels of the Tnni3k Gene in the Heart Are Highly Associated with Cardiac and Glucose Metabolism-Related Phenotypes and Functional Pathways,"Gu Q, Orgil BO, Bajpai AK, Chen Y, Ashbrook DG, Starlard-Davenport A, Towbin JA, Lebeche D, Purevjav E, Sheng H, Lu L.",Int J Mol Sci. 2023 Aug 14;24(16):12759. doi: 10.3390/ijms241612759.,Gu Q,Int J Mol Sci,2023,2023/08/26,PMC10454158,,10.3390/ijms241612759
2795,30981186,Atractylenolide III ameliorates cerebral ischemic injury and neuroinflammation associated with inhibiting JAK2/STAT3/Drp1-dependent mitochondrial fission in microglia,"Zhou K, Chen J, Wu J, Wu Q, Jia C, Xu YXZ, Chen L, Tu W, Yang G, Kong J, Kou J, Jiang S.",Phytomedicine. 2019 Jun;59:152922. doi: 10.1016/j.phymed.2019.152922. Epub 2019 Apr 6.,Zhou K,Phytomedicine,2019,2019/04/14,,,10.1016/j.phymed.2019.152922
