,PMID,abstract
130,38693590,"Distressing symptoms are common in advanced cancer. Medicinal cannabinoids are commonly prescribed for a variety of symptoms. There is little evidence to support their use for most indications in palliative care. This study aims to assess a 1:20 delta-9-tetrahydrocannabinol/cannabidiol (THC/CBD) cannabinoid preparation in the management of symptom distress in patients with advanced cancer undergoing palliative care. One hundred and fifty participants will be recruited across multiple sites in Queensland, Australia. A teletrial model will facilitate the recruitment of patients outside of major metropolitan areas. The study is a pragmatic, multicenter, randomised, placebo-controlled, two-arm trial of escalating doses of an oral 1:20 THC/CBD medicinal cannabinoid preparation (10 mg THC:200 mg CBD/mL). It will compare the efficacy and safety outcomes of a titrated dose range of 2.5 mg THC/50mgCBD to 30 mg THC/600 mg CBD per day against a placebo. There is a 2-week patient-determined titration phase, to reach a dose that achieves symptom relief or intolerable side effects, with a further 2 weeks of assessment on the final dose. The primary objective is to assess the effect of escalating doses of a 1:20 THC/CBD medicinal cannabinoid preparation against placebo on change in total symptom distress score, with secondary objectives including establishing a patient-determined effective dose, the effect on sleep quality and overall quality of life. Some patients will be enrolled in a sub-study which will more rigorously evaluate the effect on sleep. MedCan-3 is a high-quality, adequately powered, placebo-controlled trial which will help demonstrate the utility of a THC:CBD 1:20 oral medicinal cannabis product in reducing total symptom distress in this population. Secondary outcomes may lead to new hypotheses regarding medicinal cannabis' role in particular symptoms or in particular cancers. The sleep sub-study will test the feasibility of using actigraphy and the Insomnia Severity Index (ISI) in this cohort. This will be the first large-scale palliative care randomised clinical trial to utilise the teletrial model in Australia. If successful, this will have significant implications for trial access for rural and remote patients in Australia and internationally. ANZCTR ACTRN12622000083796 . Protocol number 001/20. Registered on 21 January 2022. Recruitment started on 8 August 2022. "
131,36587508,"Using data from two methodologically independent youth research studies in Canada, the Health Behaviour in School-aged Children (HBSC) study and the Cannabis, Obesity, Mental health, Physical activity, Alcohol, Smoking, and Sedentary behaviour (COMPASS) study, the objective of this study was to compare associations between youth's mental health and cannabis use across samples. Using similar indicators in both studies, our goal was to affirm the potential for nationally representative cross-sectional analyses (HBSC) to replicate findings found in a longitudinal non-representative data source (COMPASS), enhancing opportunity for causal inferences. Data were collected from grade 9 and 10 Canadian students participating in the 2017/18 HBSC (n=8462) and 2017/18 to 2018/19 waves of COMPASS (n=32,023). Using multivariable Poisson regression models, the strength and statistical significance of the effects of mental health indicators on cannabis use outcomes were estimated within both studies and compared for consistency. Using a 2-year linked sample of students participating in COMPASS, models examining the impact of mental health indicators on cannabis use initiation and maintenance over time were similarly fit using Poisson regression to estimate relative risk. Similar associations between mental health problems and cannabis use were observed in both data sources. The direction, magnitude, and precision of the estimates for restless sleep, loneliness, poor wellbeing, and cannabis use were highly comparable across both studies. Worse mental health was consistently associated with current and lifetime cannabis use among youth. Cross-sectional and longitudinal findings from two large methodologically diverse studies in Canada demonstrate a replicable association between indicators of mental health and youth cannabis use. Similarities were identified and two generalizations may be concluded: 1) potentially causal etiological relationships inferred from HBSC data were supported in longitudinal findings based on COMPASS, and 2) longitudinal COMPASS data aligns with nationally representative data from HBSC. "
132,37292156,
133,34052339,"Medical cannabis access has been legalized in more than 30 countries worldwide and popularity among patients is increasing rapidly. Cannabinoid-based treatments have been shown to be beneficial for several symptoms such as chemotherapy-induced nausea and vomiting, spasticity, chronic pain, intractable seizures and insomnia, yet high-quality clinical trials are still limited. As millions of patients now have legal access to medical cannabis, little information is available about the development of best clinical practices and an effective medical cannabis clinic model. A medical cannabis clinic is an innovative and emergent practice model that may be necessary to bridge the gap between patient and healthcare provider interest and existing barriers to the prescription of medical cannabis treatments, such as limited medical education, lack of high-quality clinical research and challenging or evolving regulatory frameworks. In this paper, we describe the model of care and organization of a dedicated medical cannabis clinic operating in Quebec, Canada since 2014. We share the principles of medical cannabis practice, including the structure of its medical and support team, clinic organisation and procedure guidelines. Key clinic statistics and patient demographics are shared with year by year comparison. Operating since 2014, the clinic has endured a rapidly changing regulatory landscape in Canada, overcoming numerous challenges including medical and social stigma, limited funding, resources and institutional support combined with a high demand for services. To support medical cannabis leaders globally, an important knowledge-sharing is required. The clinic has expanded to a network of four clinic sites across Quebec and offers continuing education and preceptorships to health care providers and trainees as well as research services to both academic and industry partners. The description of the clinic offers guidance on medical cannabis treatment and care and discusses possible solutions to associated challenges. The clinic model of care can be adapted to different healthcare settings and regulatory frameworks; it may assist physicians and health care providers in the development of medical cannabis clinics or the implementation of best practices as medical cannabis access continues to evolve. "
134,34512404,"""Medicinal cannabis"" is defined as the use of cannabis-based products for the treatment of an illness. Investigations of cannabis compounds in psychiatric and neurological illnesses primarily focus on the major cannabinoids, cannabidiol (CBD) and Δ "
135,33204797,"Research within a gynecologic oncology population has lagged behind the uptake in use of medical cannabis for symptom control. This study seeks to evaluate patient experience with prescribed medical cannabis obtained through licensed dispensaries in women with gynecologic malignancies. A 43-item survey exploring patient experience with medical cannabis was administered to women with gynecologic malignancies who used medical cannabis prescribed by a gynecologic oncologist. Thirty-six eligible patients were approached for consent, and 31 patients returned completed surveys (86%). Ninety-three percent had advanced or recurrent disease; 74% were receiving chemotherapy or immunotherapy. Eighty-three percent reported medical cannabis provided relief from cancer or treatment-related symptoms including decreased appetite (41%), insomnia (41%), neuropathy (41%), anxiety (35%), nausea (29%), joint pain (29%), bone pain (29%), abdominal pain (25%), and depression (19%). Eighty percent of patients reported medical cannabis worked the same or better than other traditional medications for management of their cancer or treatment-related symptoms, and 83% reported medical cannabis had an equivalent or better side effect profile. Of the subset of patients using medical cannabis for pain, 63% reported a reduction in opioid use. Patients perceive that medical cannabis was useful for relief of cancer and treatment-related symptoms, suggesting medical cannabis may be a reasonable alternative or adjunct therapy. Medical cannabis was well tolerated and may have the potential to improve neuropathic pain and decrease opioid use. "
136,25135784,"Substance use disorders (SUD) are common and individuals who suffer from them are prone to relapse. One of the most common consequences of the use of and withdrawal from substances of abuse is sleep disturbance. Substances of abuse affect sleep physiology, including the neurotransmitter systems that regulate the sleep-wake system. Emerging research now highlights an interactive effect between sleep disorders and substance use. New findings in alcohol and sleep research have utilized sophisticated research designs and expanded the scope of EEG and circadian rhythm analyses. Research on marijuana and sleep has progressed with findings on the effects of marijuana withdrawal on objective and subjective measures of sleep. Treatment studies have focused primarily on sleep in alcohol use disorders. Therapies for insomnia in cannabis disorders are needed. Future research is poised to further address mechanisms of sleep disturbance in alcoholics and the effect of medical marijuana on sleep and daytime functioning. "
137,34935467,
138,4606306,
139,28340421,"Medical cannabis is increasingly being used for a variety of health conditions as more states implement legislation permitting medical use of cannabis. Little is known about medical cannabis use patterns and motives among adults across the lifespan. The present study examined data collected at a medical cannabis dispensary in San Francisco, California. Participants included 217 medical cannabis patients who were grouped into age-defined cohorts (younger: 18-30, middle-aged: 31-50, and older: 51-72). The age groups were compared on several measures of cannabis use, motives and medical conditions using one-way ANOVAs, chi-square tests and linear regression analyses. All three age groups had similar frequency of cannabis use over the past month; however, the quantity of cannabis used and rates of problematic cannabis use were higher among younger users relative to middle-aged and older adults. The association between age and problematic cannabis use was moderated by age of regular use initiation such that earlier age of regular cannabis use onset was associated with more problematic use in the younger users, but not among older users. Middle-aged adults were more likely to report using medical cannabis for insomnia, while older adults were more likely to use medical cannabis for chronic medical problems such as cancer, glaucoma and HIV/AIDS. Younger participants reported cannabis use when bored at a greater rate than middle-aged and older adults. Findings suggest that there is an age-related risk for problematic cannabis use among medical cannabis users, such that younger users should be monitored for cannabis use patterns that may lead to deleterious consequences. "
140,37269785,"Young adults (18-30 years) are vulnerable to sleep-wake disturbances and substance use, which are bi-directionally associated. The present work aims to organise the literature that deals with the association between sleep and substance use in young adults, also considering self-medication behaviours. We adopted a framework that accounts for the multidimensionality of sleep and the effect of different substances. We considered sleep disturbances (insomnia symptoms, sleep quality), sleep health dimensions (duration, satisfaction, efficiency, timing, daytime alertness), circadian characteristics (chronotype). Substances were alcohol, caffeine, nicotine, cannabis, others. We included 46 studies. The use of caffeine and nicotine was associated with higher odds of sleep disturbances. No significant effect was detected for sleep duration. In narrative findings, daytime dysfunction was associated with alcohol and caffeine use, and poor sleep satisfaction with nicotine use. Few evidence were available for the other sleep health dimensions. Evening chronotype was associated with alcohol, caffeine, and nicotine use. Few studies focused on cannabis or self-medication. Longitudinal results were inconclusive. We found a distinct pattern of associations between different substances and different sleep outcomes. Further investigation considering the multidimensionality of sleep would create a better understanding of the complex relationship between substance use and sleep health in young adults. "
141,30822492,"The use of Cannabis for medical purposes is rapidly expanding and is usually employed as a self-medication for the treatment of insomnia disorder. However, the effect on sleep seems to depend on multiple factors such as composition of the Cannabis, dosage and route of administration. Vaporization is the recommended route for the administration of Cannabis for medical purposes; however, there is no published research about the effects of vaporized Cannabis on sleep, neither in laboratory animals, nor in humans. Because previous reports suggested that low doses of THC have sedating effects, the aim of the present study was to characterize in rats, the acute effects on sleep induced by the administration of low doses of THC by means of vaporization of a specific type of Cannabis (THC 11.5% and negligible amounts of other cannabinoids). For this purpose, polysomnographic recordings in chronically prepared rats were performed during 6 h in the light and dark phases. Animals were treated with 0 (control), 40, 80 and 200 mg of Cannabis immediately before the beginning of recordings; the THC plasma concentrations with these doses were low (up to 6.7 ng/mL with 200 mg). A quantitative EEG analyses by means of the spectral power and coherence estimations was also performed for the highest Cannabis dose. Compared to control, 200 mg of Cannabis increased NREM sleep time during the light phase, but only during the first hour of recording. Interestingly, no changes on sleep were observed during the dark (active) phase or with lower doses of Cannabis. Cannabis 200 mg also produced EEG power reductions in different cortices, mainly for high frequency bands during W and REM sleep, but only during the light phase. On the contrary, a reduction in the sleep spindles intra-hemispheric coherence was observed during NREM sleep, but only during the dark phase. In conclusion, administration of low doses of THC by vaporization of a specific type of Cannabis produced a small increment of NREM sleep, but only during the light (resting) phase. This was accompanied by subtle modifications of high frequency bands power (during the light phase) and spindle coherence (during the dark phase), which are associated with cognitive processing. Our results reassure the importance of exploring the sleep-promoting properties of Cannabis. "
142,30994387,
143,37884682,"The side effects of cancer therapy continue to cause significant health and cost burden to the patient, their friends and family, and governments. A major barrier in the way in which these side effects are managed is the highly siloed mentality that results in a fragmented approach to symptom control. Increasingly, it is appreciated that many symptoms are manifestations of common underlying pathobiology, with changes in the gastrointestinal environment a key driver for many symptom sequelae. Breakdown of the mucosal barrier (mucositis) is a common and early side effect of many anti-cancer agents, known to contribute (in part) to a range of highly burdensome symptoms such as diarrhoea, nausea, vomiting, infection, malnutrition, fatigue, depression, and insomnia. Here, we outline a rationale for how, based on its already documented effects on the gastrointestinal microenvironment, medicinal cannabis could be used to control mucositis and prevent the constellation of symptoms with which it is associated. We will provide a brief update on the current state of evidence on medicinal cannabis in cancer care and outline the potential benefits (and challenges) of using medicinal cannabis during active cancer therapy. "
144,35838430,"Medicinal cannabis use (MCU) among youth is correlated with frequent cannabis use and multiple substance use and health-related indicators. This study examined whether correlates of self-reported MCU among youth varied as a function of the primary health condition for which cannabis is used. Data were drawn from the 2017 Canadian Tobacco, Alcohol, and Drugs Survey. Youth (ages 15-24) who reported past-year cannabis use were included in these analyses. Regression analyses (controlling for age and sex) compared youth reporting only nonmedicinal cannabis use (NMCU only,  Relative to youth reporting NMCU only, youth reporting MCU for physical or mental health conditions had greater odds of reporting daily cannabis use, cannabis problems, vaporization and oral ingestion of cannabis, and tobacco use. Youth reporting MCU for physical health reasons also had greater odds of both illicit drug use and prescription pain medication use, whereas youth reporting MCU for mental health reasons had greater odds of prescription sedative use. Youth in both the physical health and mental health MCU groups reported poorer health and mental health compared with the NMCU-only group. Youth reporting MCU for insomnia had greater odds of cannabis problems relative to youth in the NMCU-only group, but there were no other differences between these groups. Findings provide new insight into the correlates of MCU among youth in the Canadian population, suggesting that these correlates vary as a function of the primary reason for MCU. "
145,31692541,"To evaluate interest in and patterns of use of non-prescription cannabis products for symptom management amongst gynecologic cancer patients living in states with legal access to medical and recreational marijuana. Cross-sectional study using a novel 35-question survey distributed to women diagnosed with gynecologic cancer within two academic centers in California and Colorado. The survey queries demographic and disease traits, and both objective and subjective issues surrounding use of cannabis products for symptom management. Surveys were distributed to patients actively receiving treatment or under surveillance. Enrollment began July 16, 2018 and was completed December 1, 2018. Survey return rate was 52.7%. A total of 225 participants met inclusion criteria.Sixty-two percent reported that they have used or would be interested in using cannabis products for symptom management; 60 (26.7%) are using non-prescription cannabis for treatment of cancer related symptoms, and 80 (35.6%) are interested in using cannabis derivatives under direction of their oncologist. Reasons cited for use of cannabis included: pain control (n = 41, 68.3), insomnia (n = 33, 55.0%), anxiety (n = 29, 48.3%), nausea (n = 26, 43.3%), and appetite stimulation (n = 21, 35.0%). Of the women using cannabis products, almost half report decreased prescription narcotic use after initiation of cannabis products (n = 27, 45.0%). Women with gynecologic cancer report a strong interest in the use of non-prescription cannabis products for management of cancer-related symptoms. Practitioners in the field of gynecologic oncology should be aware of the frequency of use of non-prescription cannabis amongst their patients as well as the growing desire for guidance about the use of cannabis derivatives. A substantial number of patients report decreased reliance on opioids when using cannabis derivatives for pain control. "
146,36182689,"Despite increasing use of Medical Cannabis (MC) among posttraumatic stress disorder (PTSD) patients, research is lacking on how MC treatment relates to PTSD symptomatology, in particular sleep disturbances. This study examines the time gap between MC use and sleep onset and its association with (1) number of awakenings throughout the night, (2) early awakenings, (3) nightmares. Each morning over a two week period, 77 licensed MC patients suffering from PTSD reported on the timing of previous night MC use and sleep disturbances. Within-person analyses found that shorter time gaps between previous night MC use and sleep start time was associated with lower likelihood of experiencing nightmares throughout the night, but it was not associated with nightly awakenings or waking up too early. Between-person analyses showed that individuals who used MC products with higher CBD concentrations reported fewer early awakenings. These preliminary results indicate that future research should test causal relations between MC use and sleep problems in PTSD patients. Future research is warranted in order to explore causal relationships between MC use, nightmares and insomnia in PTSD patients. "
147,38703603,"There is a profound connection between abnormal sleep patterns and brain disorders, suggesting a shared influential association. However, the shared genetic basis and potential causal relationships between sleep-related traits and brain disorders are yet to be fully elucidated. Utilizing linkage disequilibrium score regression (LDSC) and bidirectional two-sample univariable Mendelian Randomization (UVMR) analyses with large-scale GWAS datasets, we investigated the genetic correlations and causal associations across six sleep traits and 24 prevalent brain disorders. Additionally, a multivariable Mendelian Randomization (MVMR) analysis evaluated the cumulative effects of various sleep traits on each brain disorder, complemented by genetic loci characterization to pinpoint pertinent genes and pathways. LDSC analysis identified significant genetic correlations in 66 out of 144 (45.8 %) pairs between sleep-related traits and brain disorders, with the most pronounced correlations observed in psychiatric disorders (66 %, 48/72). UVMR analysis identified 29 causal relationships (FDR<0.05) between sleep traits and brain disorders, with 19 associations newly discovered according to our knowledge. Notably, major depression, attention-deficit/hyperactivity disorder, bipolar disorder, cannabis use disorder, and anorexia nervosa showed bidirectional causal relations with sleep traits, especially insomnia's marked influence on major depression (IVW beta 0.468, FDR = 5.24E-09). MVMR analysis revealed a nuanced interplay among various sleep traits and their impact on brain disorders. Genetic loci characterization underscored potential genes, such as HOXB2, while further enrichment analyses illuminated the importance of synaptic processes in these relationships. This study provides compelling evidence for the causal relationships and shared genetic backgrounds between common sleep-related traits and brain disorders. "
148,37574376,"Research investigating cannabis use and sleep health is limited, and results are mixed. Few studies were nationally representative with racially-ethnically diverse samples or assessed potential modifiers. Our objective was to investigate cross-sectional associations between reported cannabis use and sleep disturbances by potential modifiers among non-Hispanic White, non-Hispanic Black, and Hispanic/Latino men and women in the United States. We used nationally representative National Comorbidity Survey-Replication data collected from 2001 to 2003 among 3929 adults. Poisson regression with robust variance estimated prevalence ratios (PR) and 95% confidence intervals of patterns of sleep disturbances identified through latent class analysis. Models adjusted for sociodemographic, health behavior, and clinical characteristics were stratified by race-ethnicity and by race-ethnicity along with sex/gender, and age, separately. Over half of adults reported cannabis use (52%-ever/lifetime vs 48%-never). We identified two latent classes: multiple sleep disturbances with daytime sleepiness and no sleep disturbances with some daytime sleepiness. Prevalence of multiple sleep disturbances with daytime sleepiness was higher among participants reporting lifetime cannabis use (23% vs 20%). Associations did not vary by race-ethnicity or sex/gender. Lifetime vs never cannabis use was marginally associated with a higher prevalence of multiple sleep disturbances with daytime sleepiness only among adults aged 25-29years (PR=1.09 [95% confidence interval: 1.00-1.18]; eg, PR Associations between cannabis use and sleep may vary by age. Replication with more recent data and prospective studies that investigate intersectional identities among diverse populations with objective assessments are warranted. "
