,PMID,abstract
99,26187404,"Cannabis is the most frequently used illicit substance in the United States resulting in high rates of cannabis use disorders. Current treatments for cannabis use are often met with high rates of lapse/relapse, tied to (1) behavioral health factors that impact cannabis use such as poor sleep, and (2) access, stigma, supply, and cost of receiving a substance use intervention. This pilot study examined the feasibility, usability, and changes in cannabis use and sleep difficulties following mobile phone-delivered Cognitive Behavioral Therapy for Insomnia (CBT-I) in the context of a cannabis cessation attempt. Four male veterans with DSM-5 cannabis use disorder and sleep problems were randomized to receive a 2-week intervention: CBT-I Coach mobile app (n=2) or a placebo control (mood-tracking app) (n=2). Cannabis and sleep measures were assessed pre- and post-treatment. Participants also reported use and helpfulness of each app. Changes in sleep and cannabis use were evaluated for each participant individually. Both participants receiving CBT-I used the app daily over 2 weeks and found the app user-friendly, helpful, and would use it in the future. In addition, they reported decreased cannabis use and improved sleep efficiency; one also reported increased sleep quality. In contrast, one participant in the control group dropped out of the study, and the other used the app minimally and reported increased sleep quality but also increased cannabis use. The mood app was rated as not helpful, and there was low likelihood of future participation. This pilot study examined the feasibility and initial patient acceptance of mobile phone delivery of CBT-I for cannabis dependence. Positive ratings of the app and preliminary reports of reductions in cannabis use and improvements in sleep are both encouraging and support additional evaluation of this intervention. "
100,32433200,"Despite substantial controversies concerning patients' reports of benefits from cannabis for posttraumatic stress disorder (PTSD) and inconsistent research findings regarding its efficacy and adverse risks, some states have already recognized PTSD as a qualifying condition for medical cannabis. Consequently, medical cannabis can also be provided for patients with complex PTSD who experience additional posttraumatic symptoms of affective dysregulation, negative perception of the self, and difficulties in relationships due to a history of repetitive trauma. In this article, we explore cannabis use in relation to benefits versus harms that might occur relative to specific complex PTSD symptoms and comorbidities. Whereas some symptoms related to PTSD per se (e.g., anxiety, insomnia, nightmares) may be benefited, others that are more characteristic of complex PTSD (e.g., dissociation, reckless behavior, and substance abuse associated with dysregulated affect) may be aggravated. Therefore, clinicians treating patients with complex PTSD who use or seek cannabis should carefully assess patients' motivations and the impacts of particular use patterns on specific symptoms. Clinicians and patients should be aware of and fully discuss the significant number of potential adverse effects of cannabis use, several of which might impede patients' participation in beneficial psychotherapeutic, social, and medical interventions. "
101,37920683,"Medical cannabis (MC) is used by Canadian Veterans to manage a wide range of health issues. However, there is little information comparing the reasons for MC use and its perceived effectiveness between Veterans and non-Veterans. We compared MC use among a convenience sample of Canadian Veterans and with non-Veteran controls, including demographics, reasons and patterns of use, and perceived effectiveness. Between November and December 2021, Canadian Veterans using cannabis were invited to participate in a survey using a national press release, social media, and announcements on online platform dedicated to promoting health among Canadian Veterans and non-Veterans during the pandemic (www.MissionVav.com). The survey was also mentioned in a monthly newsletter from Veteran Affairs Canada. Self-reported effectiveness was evaluated using a 0 to 10 visual analogue scale (0 being not all effective, 10 being the most effective). The survey was completed by 157 people, including 108 (69%) males and 49 (31%) females. The mean age was 57 years (range 19 to 84). Among responders, 90 (63%) identified as Veterans. The most common reasons for MC use among Veterans included: insomnia (80%), anxiety (73%), and depression (52%). Veterans reported medical conditions such as chronic pain (88%) and arthritis (51%). Compared with non-Veterans, Veterans were significantly more likely to be male (83% vs. 49%), have a higher BMI (35.2 vs. 30.9), to report problems with sleep, anxiety, depression, and PTSD, and to use cannabis in edible form (51% vs. 22%). Self-reported mean effectiveness scores for MC were highest for PTSD (8.4), insomnia (8.2), anxiety (8.1), depression (8.0), and chronic pain (7.6). We found important differences in user characteristics and cannabis use patterns between Canadian Veterans and non-Veterans. Further controlled studies are required to validate these findings, but these data suggest that orally administered cannabis products may be worth further study. "
102,38981156,"Fatigue, insomnia and sleep disturbances are common after cancer diagnosis, and have a negative impact on quality of life and function. This narrative review synthesised evidence on lifestyle and integrative oncology interventions for cancer-related fatigue, insomnia and sleep disturbances in cancer survivors. There is strong evidence in support of aerobic and strength exercise for the relief of cancer-related fatigue. Yoga, massage therapy, acupuncture, Tai Chi and qigong can also be recommended for cancer-related fatigue. The evidence on yoga, acupuncture and massage therapy for sleep disturbances in cancer is mixed, while exercise appears to have a modest favourable effect. There is insufficient evidence on nutrient supplements or dietary interventions for cancer-related fatigue or insomnia and other sleep disturbances after cancer. Beyond alleviating cancer-related fatigue and insomnia-related symptoms, integrative oncology and lifestyle interventions have potential to effect multiple other benefits, such as improvement in symptoms such as pain and menopausal symptoms. There is a need for well-designed randomised controlled trials of interventions, particularly in the areas of diet and nutrient supplements, and for implementation studies of interventions already supported by evidence. "
103,24765558,"Clinical research regarding the therapeutic benefits of cannabis (""marijuana"") has been almost non-existent in the United States since cannabis was given Schedule I status in the Controlled Substances Act of 1970. In order to discover the benefits and adverse effects perceived by medical cannabis patients, especially with regards to chronic pain, we hand-delivered surveys to one hundred consecutive patients who were returning for yearly re-certification for medical cannabis use in Hawai'i. The response rate was 94%. Mean and median ages were 49.3 and 51 years respectively. Ninety-seven per cent of respondents used cannabis primarily for chronic pain. Average pain improvement on a 0-10 pain scale was 5.0 (from 7.8 to 2.8), which translates to a 64% relative decrease in average pain. Half of all respondents also noted relief from stress/anxiety, and nearly half (45%) reported relief from insomnia. Most patients (71%) reported no adverse effects, while 6% reported a cough or throat irritation and 5% feared arrest even though medical cannabis is legal in Hawai'i. No serious adverse effects were reported. These results suggest that Cannabis is an extremely safe and effective medication for many chronic pain patients. Cannabis appears to alleviate pain, insomnia, and may be helpful in relieving anxiety. Cannabis has shown extreme promise in the treatment of numerous medical problems and deserves to be released from the current Schedule I federal prohibition against research and prescription. "
104,34636036,"The goal of this study was to characterize cannabis use among patients with breast cancer, including their reasons for and timing of use, their sources of cannabis information and products, their satisfaction with the information found, their perceptions of its safety, and their dialogue about cannabis with their physicians. United States-based members of the Breastcancer.org and Healthline.com communities with a self-reported diagnosis of breast cancer within 5 years (age ≥ 18 years) were invited to participate in an anonymous online survey. After informed consent was obtained, nonidentifiable data were collected and analyzed. Of all participants (n = 612), 42% (n = 257) reported using cannabis for relief of symptoms, which included pain (78%), insomnia (70%), anxiety (57%), stress (51%), and nausea/vomiting (46%). Furthermore, 49% of cannabis users believed that medical cannabis could be used to treat cancer itself. Of those taking cannabis, 79% had used it during treatment, which included systemic therapies, radiation, and surgery. At the same time, few (39%) had discussed it with any of their physicians. A significant percentage of survey participants (42%) used cannabis to address symptoms; approximately half of these participants believed that cannabis could treat cancer itself. Most participants used cannabis during active cancer treatment despite the potential for an adverse event during this vulnerable time. Furthermore, most participants believed that cannabis was safe and were unaware that product quality varied widely and depended on the source. This study reviews the research on medicinal cannabis in the setting of these findings to help physicians to recognize its risks and benefits for patients with cancer. Almost half of patients with breast cancer use cannabis, most commonly during active treatment to manage common symptoms and side effects: pain, anxiety, insomnia, and nausea. However, most patients do not discuss cannabis use with their physicians. Instead, the internet and family/friends are the most common sources of cannabis information. Furthermore, most participants believe that cannabis products are safe and are unaware that the safety of many products is untested. "
105,37917012,"As the U.S. cannabis market expands, surveillance of retailer practices, especially product health claims and risks, is crucial to protect consumers. In this study, mystery shoppers (i.e., staff not explicitly identified as researchers) examined retail personnel communication regarding product recommendations, health benefits, safety, and/or risks among U.S. cannabis retailers. In Summer 2022, mystery shoppers audited 140 licensed cannabis retailers in 5 cities in states with established nonmedical (i.e., recreational) cannabis sales and diverse regulations (Denver, Colorado; Seattle, Washington; Portland, Oregon; Las Vegas, Nevada; Los Angeles, California). Descriptive and bivariate analyses characterized retail personnel communication overall and across cities. Common product recommendations for new users included edibles, pre-rolled joints, and bud/flower, and 8.6% offered free/inexpensive ways to sample products. Although Colorado, Washington, and Oregon explicitly prohibited health claims in advertising or labels, more than 90% of retailers there endorsed use for anxiety, insomnia, and/or pain. Whereas 54.3% endorsed use for pregnancy-related nausea (least common in Denver, 23.3%; most common in Seattle, 76.7%), 26.4% warned against use during pregnancy (most frequently in Denver, 46.7%; least frequently in Seattle and Portland, 13.3%). Overall, 52.1% warned against driving after use (most frequently in Denver, 80.0%; least frequently in Las Vegas, 20.0%). Almost all (≥90%) sold cannabidiol (CBD) products and endorsed their health benefits and safety, but few (<10%) sold or endorsed delta-8 tetrahydrocannabinol (THC), etc. (all of which were in Los Angeles). Ongoing cannabis retail surveillance, particularly using protocols assessing factors outside those visibly observable, is needed to inform regulatory and enforcement efforts, especially related to health claims. "
106,37090897,"Sleep disorders are the third most common indication for the prescription of medical cannabis products in Australia, after pain and anxiety. While the use of cannabis for medical purposes is growing in Australia, underlying consumer behaviours and patterns of use, particularly around sleep disorders, are poorly understood. We conducted a subanalysis of the cross-sectional ""Cannabis as Medicine Survey"" 2020-2021 (CAMS-20) (N = 1600), to explore the characteristics of a sample of Australians who were using prescribed and/or illicit medical cannabis to treat a self-reported sleep disorder. When asked to specify up to seven different conditions they were treating with medical cannabis, a total of 1030 (64%) respondents [mean (SD) 44.9 (13.6) years] selected a sleep disorder, with ""insomnia disorder"" (85.5%), 'sleep-related movement disorders' (26%) and 'sleep-related breathing disorders' (11.1%) the most common subtypes. Only 165 (16.8%) respondents selected a self-reported sleep disorder as the main health condition being treated. Relative to other health conditions, use of medical cannabis for a self-reported sleep disorder was associated with younger age, increased likelihood of using both prescribed and illicit forms of medical cannabis, inhaled routes of administration, and THC-dominant products. Most respondents reported a reduction in the use of benzodiazepines and alcohol since starting medical cannabis. Binary logistic regression showed that respondents who predominantly used inhaled routes of administration, and concomitant use of medical cannabis for pain, mental health and/or substance use disorder, or a gastrointestinal disorder, were significantly more likely to also use medical cannabis to treat a self-reported sleep disorder. Overall, these results suggest that self-reported sleep disorders are often being treated with medical cannabis alongside other health conditions (often pain or a mental health disorder) and that use of inhaled methods, THC-dominant products, and illicit sources of medical cannabis are common among people with self-reported sleep disorders in Australia. "
107,27117064,"Sleep abnormalities are associated with acute and chronic use of addictive substances. Although sleep complaints associated with use and abstinence from addictive substances are widely recognized, familiarity with the underlying sleep abnormalities is often lacking, despite evidence that these sleep abnormalities may be recalcitrant and impede good outcomes. Substantial research has now characterized the abnormalities associated with acute and chronic use of alcohol, cannabis, cocaine, and opiates. This review summarizes this research and discusses the clinical implications of sleep abnormalities in the treatment of substance use disorders. "
108,38296858,"Cannabis sativa has been used for improving sleep for long history. Cannabidiol (CBD) has drown much attention as a non-addictive psychoactive component in Cannabis sativa extract. However, the effects of CBD on sleep architecture and it's acting mechanism remains unclear. In the present study, we evaluated the sedative-hypnotic effect of cannabidiol (CBD), assessed the effects of CBD on sleep using a wireless physiological telemetry system. We further explored the therapeutic effects of CBD using 4-chloro-dl-phenylalanine (PCPA) induced insomnia model and changes in sleep latency, sleep duration and intestinal flora were evaluated. CBD shortened sleep latency and increases sleep duration in both normal and insomnia mice, and those effects were blocked by 5-HT "
109,33244728,"Insomnia is associated with significant comorbidity, disability and impact on quality of life and, despite advances in pharmacotherapy and psychotherapy, remains a significant burden to society. Cannabinoids are gaining acceptance for use as medicines in the treatment of insomnia disorder. We conducted a systematic review and meta-analysis to evaluate the efficacy of cannabinoids in the treatment of insomnia disorder. We performed a systematic review of the PubMed, Cochrane Library, MEDLINE, and Cumulative Index to Nursing and Allied Health Literature Complete databases from inception to 5 December 2019, and again prior to data abstraction, for studies of cannabis-based products for the treatment of insomnia disorder in adults. Inclusion criteria were (1) clinical studies, (2) participants aged ≥ 18 years, (3) insomnia disorder either formally diagnosed against contemporaneous diagnostic criteria or quantified with validated instruments and (4) compared cannabis-based products with the standard of care, placebo or a sedative. No language restrictions were imposed. Non-primary research, animal studies and studies of cannabis-induced insomnia were excluded. Risk of bias was assessed using the RoB 2 tool for randomised controlled trials (RCTs) and Risk of Bias in Non-randomized Studies-of Interventions (ROBINS-I) tool for non-randomized trials. Heterogeneity was assessed with the I A total of five studies (two RCTs and three non-randomised studies) with 219 study participants were included, of which three could be combined. The three non-randomised studies contributed data on the Pittsburgh Sleep Quality Index Questionnaire score, showing a favourable effect of cannabinoids at ≤ 4 weeks of follow-up (mean difference - 1.89 [95% confidence interval {CI} - 2.68 to - 1.10]; n = 176) and at 8 weeks of follow-up (mean difference - 2.41 [95% CI - 3.36 to - 1.46]; n = 166). One double-blind crossover RCT (n = 32) reported that, compared with amitriptyline, nabilone-a synthetic analogue to tetrahydrocannabinol (THC)-improved Insomnia Severity Index scores after 2 weeks of treatment (adjusted difference - 3.25 [95% CI - 5.26 to - 1.24]) and resulted in a more restful sleep as a sub-measure of the Leeds Sleep Evaluation Questionnaire (LSEQ) (difference 0.48 [95% CI 0.01-0.95]) but with no effect on overall sleep quality as measured by the LSEQ. In a single ascending-dose RCT (n = 9), THC reduced sleep-onset latency compared with placebo at 10 mg, 20 mg and 30 mg doses (mean difference - 43.00 min [95% CI - 82.76 to - 3.24], - 62.00 [95% CI - 103.60 to - 20.40] and - 54.00 [95% CI - 103.93 to - 4.07], respectively). All the included studies were assessed as poor quality, mainly due to small sample sizes, short treatment periods, uncertain clinical significance and high risk of bias. Few studies have examined the efficacy of cannabinoids in the treatment of insomnia disorder. Despite some possible signals for efficacy, the heterogeneity of participants, interventions, efficacy outcomes and results, and the high risk of bias across included trials, do not reliably inform evidence-based practice. This review highlights shortcomings in the existing literature, including lack of diagnostic clarity, poorly defined participant groups, non-standardised interventions and studies of inappropriate design, duration and power to detect clinically meaningful outcomes. Further research in the form of high-quality RCTs are required before drawing any conclusions about the efficacy of cannabinoids in the treatment of insomnia disorder. PROSPERO registration number, CRD42020161043. "
110,36787672,"Despite limited clinical evidence of its efficacy, cannabis use has been commonly reported for the management of various mental health concerns in naturalistic field studies. The aim of the current study was to use machine learning methods to investigate predictors of perceived symptom change across various mental health symptoms with acute cannabis use in a large naturalistic sample. Data from 68,819 unique observations of cannabis use from 1307 individuals using cannabis to manage mental health symptoms were analyzed. Data were extracted from Strainprint®, a mobile app that allows users to monitor their cannabis use for therapeutic purposes. Machine learning models were employed to predict self-perceived symptom change after cannabis use, and SHapley Additive exPlanations (SHAP) value plots were used to assess feature importance of individual predictors in the model. Interaction effects of symptom severity pre-scores of anxiety, depression, insomnia, and gender were also examined. The factors that were most strongly associated with perceived symptom change following acute cannabis use were pre-symptom severity, age, gender, and the ratio of CBD to THC. Further examination on the impact of baseline severity for the most commonly reported symptoms revealed distinct responses, with cannabis being reported to more likely benefit individuals with lower pre-symptom severity for depression, and higher pre-symptom severity for insomnia. Responses to cannabis use also differed between genders. Findings from this study highlight the importance of several factors in predicting perceived symptom change with acute cannabis use for mental health symptom management. Mental health profiles and baseline symptom severity may play a large role in perceived responses to cannabis. Distinct response patterns were also noted across commonly reported mental health symptoms, emphasizing the need for placebo-controlled cannabis trials for specific user profiles. "
111,30502644,"Studies suggest cannabis may improve symptoms like pain and muscle spasticity in patients with multiple sclerosis (PwMS). Despite cannabis' new-found legality and availability, few studies have explored the profile of PwMS cannabis users and characteristics of their use, particularly in a state where cannabis is legal both for recreational and medicinal use. The purpose of the current study was to evaluate cannabis use among PwMS at a large academic multiple sclerosis (MS) clinic, specifically: (1) prevalence, (2) products used (e.g., cannabidiol vs Δ PwMS completed questions assessing personal opinions about cannabis use, characteristics of cannabis use, MS history, and sociodemographic details, as well as the self-reported disability-Patient Determined Disease Steps (PDDS), overall quality of life-the Patient Reported Outcome Measure Information System (PROMIS-10), and cognition-the Neuro-QoL ACGC v1.0 measures. Thirty-eight percent (n = 96) of PwMS were current Cannabis users (CUs). Although there were no sociodemographic or clinical differences (p ≤ 0.05) between CUs and Non-Cannabis users (NUs), CUs had significantly higher median disability compared to NUs (PDDS = 2 vs. 1; p = 0.02). Among CUs, 57% categorized their use as strictly medicinal. CUs reported using cannabis most often for pain and insomnia/poor sleep and experienced greater than 60% benefit/relief from cannabis use. Over 90% of respondents desire more research on cannabis for MS, and 74% indicated they would consider using cannabis for their MS. As cannabis legalization has impacted the variety of cannabis products available, there appears to be growing numbers of PwMS using cannabis, with this study's CUs reporting use of highly efficacious products with minimal side-effects. "
112,38612415,"The endogenous cannabinoid system (ECS) plays a critical role in the regulation of various physiological functions, including sleep, mood, and neuroinflammation. Phytocannabinoids such as Δ9-tetrahydrocannabinol (THC), cannabidiol (CBD), cannabinomimimetics, and some N-acylethanolamides, particularly palmitoyethanolamide, have emerged as potential therapeutic agents for the management of sleep disorders. THC, the psychoactive component of cannabis, may initially promote sleep, but, in the long term, alters sleep architecture, while CBD shows promise in improving sleep quality without psychoactive effects. Clinical studies suggest that CBD modulates endocannabinoid signaling through several receptor sites, offering a multifaceted approach to sleep regulation. Similarly, palmitoylethanolamide (PEA), in addition to interacting with the endocannabinoid system, acts as an agonist on peroxisome proliferator-activated receptors (PPARs). The favorable safety profile of CBD and PEA and the potential for long-term use make them an attractive alternative to conventional pharmacotherapy. The integration of the latter two compounds into comprehensive treatment strategies, together with cognitive-behavioral therapy for insomnia (CBT-I), represents a holistic approach to address the multifactorial nature of sleep disorders. Further research is needed to establish the optimal dosage, safety, and efficacy in different patient populations, but the therapeutic potential of CBD and PEA offers hope for improved sleep quality and general well-being. "
