,PMID,abstract
0,36102608,"This review aims to summarize recent updates in the area of cannabis use for insomnia. Cannabis products have continued to become more potent, particularly in regard to delta-9- tetrahydrocannabinol (THC) concentration. Additionally, the use of cannabis has continued to become more accepted with less legal restrictions. The reported use of cannabis for relief of symptoms in sleep disorders appears to be increasing, however the specific effects of cannabinoids on sleep varies with cannabinoid type and concentration. Some evidence supports claims of efficacy of cannabinoids in sleep disorders such as insomnia, while other evidence is either lacking or in some cases contradictory. Regular cannabis use has been associated with withdrawal which can profoundly alter sleep. Also, clinicians should be aware of the potential effects of cannabis on the metabolism of other medications as well as the fact that cannabis use has been reported in a significant number of women in the periods before, during, and after pregnancy. Cannabis use has been becoming more and more prevalent in the setting of relaxed restrictions and easier consumer level access to cannabis and cannabis products. A relative paucity of high quality evidence regarding the effects of cannabis on sleep and the treatment of insomnia symptoms remains. The optimal type, concentration, ratio, and dosage form of cannabinoids in the treatment of insomnia symptoms needs further clarification. As the trend of acceptance and use of cannabis continues, more high quality evidence to help guide clinicians in their recommendations will hopefully become available. "
1,36539991,"Insomnia or difficulty falling and or staying asleep is experienced by up to 30% of the general population. This randomised crossover double-blind placebo-controlled 6-week trial aimed to assess the tolerability and effectiveness of the Entoura-10:15 medicinal cannabis oil on sleep in adults with insomnia. A total of 29 participants with self-reported clinical insomnia completed the crossover trial. Participants were randomly allocated to receive placebo or active oil containing 10 mg/ml tetrahydrocannabinol (THC) and 15 mg/ml cannabidiol (CBD) over 2-weeks titrated 0.2-1.5 ml/day, followed by a 1-week wash-out period before crossover. Tolerability was assessed by daily diary. Effectiveness was measured by saliva midnight melatonin levels, validated questionnaires, i.e., the Insomnia Severity Index, and the Fitbit activity/sleep wrist tracker. Entoura-10:15 medicinal cannabis oil was generally well tolerated, and was effective in improving sleep, whereby 60% of participants no longer classified as clinical insomniacs at the end of the 2-week intervention period. Midnight melatonin levels significantly improved in the active group by 30% compared to a 20% decline in the placebo group (p = 0.035). Medicinal cannabis oil improved both time and quality of sleep, in particular light sleep increased by 21 min/night compared to placebo (p = 0.041). The quality of sleep improved overall by up to 80% in the active group (p "
2,34115851,"This randomized, double-blind, placebo-controlled, crossover study was conducted to evaluate the safety and efficacy of 2 weeks of nightly sublingual cannabinoid extract (ZTL-101) in treating chronic insomnia (symptoms ≥3 months). Co-primary study endpoints were safety of the medication based on adverse event reporting and global insomnia symptoms (Insomnia Severity Index [ISI]). Secondary endpoints included: self-reported (sleep diary), actigraphy-derived, and polysomnography measurements of sleep onset latency (SOL), wake after sleep onset (WASO), total sleep time (TST), sleep efficiency (SE); and self-reported assessments of sleep quality (sSQ) and feeling rested upon waking. Adjusted mean differences between placebo and ZTL-101 were calculated. Twenty-three of 24 randomized participants (n = 20 female, mean age 53 ± 9 years) completed the protocol. No serious adverse events were reported. Forty mild, nonserious, adverse events were reported (36 during ZTL-101) with all but one resolving overnight or soon after waking. Compared to placebo, ZTL-101 decreased ISI (-5.07 units [95% CI: -7.28 to -2.86]; p = 0.0001) and self-reported SOL (-8.45 min [95% CI: -16.33 to -0.57]; p = 0.04) and increased self-reported TST (64.6 min [95% CI: 41.70 to 87.46]; p < 0.0001), sSQ (0.74 units [95% CI: 0.51 to 0.97]; p < 0.0001), and feeling of being rested on waking (0.51 units [95% CI: 0.24 to 0.78]; p = 0.0007). ZTL-101 also decreased actigraphy-derived WASO (-10.2 min [95% CI: -16.2 to -4.2]; p = 0.002), and increased actigraphy-derived TST (33.4 min [95% CI: 23.07 to 43.76]; p < 0.001) and SE (2.9% [95% CI: 2.0 to 3.8]; p = 0.005). Two weeks of nightly sublingual administration of a cannabinoid extract (ZTL-101) is well tolerated and improves insomnia symptoms and sleep quality in individuals with chronic insomnia symptoms. ANZCTR; anzctr.org.au; ACTRN12618000078257. "
3,28349316,"The current review aims to summarize the state of research on cannabis and sleep up to 2014 and to review in detail the literature on cannabis and specific sleep disorders from 2014 to the time of publication. Preliminary research into cannabis and insomnia suggests that cannabidiol (CBD) may have therapeutic potential for the treatment of insomnia. Delta-9 tetrahydrocannabinol (THC) may decrease sleep latency but could impair sleep quality long-term. Novel studies investigating cannabinoids and obstructive sleep apnea suggest that synthetic cannabinoids such as nabilone and dronabinol may have short-term benefit for sleep apnea due to their modulatory effects on serotonin-mediated apneas. CBD may hold promise for REM sleep behavior disorder and excessive daytime sleepiness, while nabilone may reduce nightmares associated with PTSD and may improve sleep among patients with chronic pain. Research on cannabis and sleep is in its infancy and has yielded mixed results. Additional controlled and longitudinal research is critical to advance our understanding of research and clinical implications. "
4,35537535,"Sleep disturbances are often cited as a primary reason for medicinal cannabis use, and there is increasing clinical interest in the therapeutic potential of cannabinoids in treating sleep disorders. Burgeoning evidence suggests a role of the endocannabinoid system in regulating the circadian sleep-wake cycle, highlighting a potential avenue for developing novel therapeutics. Despite widespread use of cannabis products as sleep aids globally, robustly designed studies verifying efficacy in sleep-disordered populations are limited. Although some study outcomes have suggested cannabinoid utility in insomnia disorder and sleep apnea, most studies to date are limited by small sample sizes, lack of rigorously controlled study designs, and high risk of bias. This critical review summarizes the current evidence for the use of cannabinoids as a treatment for sleep disorders and provides an overview of endocannabinoid modulation of sleep-wake cycles, as well as the sleep-modulating effects of plant-derived cannabinoids such as delta-9-tetrahydrocannbinol, cannabidiol, and cannabinol. The review also discusses practical considerations for clinicians regarding cannabinoid formulations, routes of administration, respiratory concerns, dosing, potential side effects, drug interactions, and effects relevant to driving, tolerance, and withdrawal. Although current interest in, and uptake of, medicinal cannabis use for sleep disorders may have surpassed the evidence base, there is a strong rationale for continued investigation into the therapeutic potential of cannabinoids. "
5,32785848,"Parkinson disease (PD) is a progressive neurodegenerative condition characterized by bradykinesia, rigidity, resting tremor, and postural instability. Non-motor symptoms, including pain, fatigue, insomnia, anxiety, and depression to name a few, are increasingly recognized and often just as disabling at motor symptoms. The mainstay of treatment is dopamine replacement; however, the beneficial effects tend to wane over time with disease progression, and patients often experience motor fluctuations and medication side effects. The lack of a disease-modifying intervention and the shortcomings of traditional symptomatic medications have led many patients to pursue complementary therapies to alleviate motor and non-motor symptoms associated with PD. The term complementary implies that the therapy is used along with conventional medicine and may include supplements, manipulative treatments (chiropractic, massage), exercise-based programs, and mind-body practices. As these practices become more widespread in Western medicine, there is a growing interest in evaluating their effects on a number of medical conditions, PD included. In this review, we provide an update on clinical trials that have evaluated the effectiveness of complementary treatments for patients with PD, specifically focusing on acupuncture, Tai Chi, Qi Gong, yoga, and cannabis. "
6,36149724,
7,35617670,"Autism spectrum disorder (ASD) is characterized by persistent deficits in social communication and social interaction and by restricted and repetitive patterns of behavior. Some studies have shown that substances derived from Cannabis sativa improve the quality of life of children with ASD without causing serious adverse effects, thus providing an alternative therapeutic option. The objective of this study was to evaluate the efficacy and safety of a cannabis extract rich in cannabidiol (CBD) in children with ASD. In this randomized, double-blind, placebo-controlled clinical trial, 60 children, aged from 5 to 11 years, were selected and divided into two groups: the treatment group, which received the CBD-rich cannabis extract, and the control group, which received the placebo. They both used their respective products for a period of 12 weeks. Statistical analysis was done by two-factor mixed analysis of variance (two-way ANOVA). Significant results were found for social interaction (F1,116 = 14.13, p = 0.0002), anxiety (F1,116 = 5.99, p = 0.016), psychomotor agitation (F1,116 = 9.22, p = 0.003), number of meals a day (F1,116 = 4.11, p = 0.04), and concentration (F1,48 = 6.75, p = 0.01), the last of which was only significant in mild ASD cases. Regarding safety, it was found that only three children in the treatment group (9.7%) had adverse effects, namely dizziness, insomnia, colic, and weight gain. CBD-rich cannabis extract was found to improve one of the diagnostic criteria for ASD (social interaction), as well as features that often co-exist with ASD, and to have few serious adverse effects. "
8,34870584,"Cannabis use is common among young adults and has been proposed as a potential treatment for insomnia. However, controlled studies examining the impact of cannabis use on insomnia symptoms are rare. This secondary analysis of published trial data tested cannabis use during cognitive behavioral treatment for insomnia (CBT-I) as a moderator of treatment efficacy. Young adults (ages 18-30 years) who reported past-month binge drinking (4/5+ drinks for women/men) and met diagnostic criteria for insomnia disorder were randomized to CBT-I (n = 28) or sleep hygiene (n = 28) groups. Interaction effects were tested using multilevel models. Outcomes included insomnia severity, actigraphy-assessed sleep efficiency, diary-assessed sleep quality, drinking quantity, and alcohol-related consequences. Twenty-six participants (46%; 12 in the sleep hygiene group and 14 in the CBT-I group) reported using cannabis during the treatment phase of the study, on an average of 23% of treatment days (range, 3%-100%). Relative to those who did not use cannabis, participants who used cannabis during treatment reported heavier drinking and more frequent cigarette use. Approximately 1 in 4 cannabis users (27%) reported using cannabis to help with sleep; however, cannabis users and nonusers did not differ in the use of alcohol as a sleep aid. Controlling for sex, race, drinking quantity, cigarette use, symptoms of depression, and symptoms of anxiety, use of cannabis during treatment did not moderate CBT-I effects on insomnia severity ( CBT-I is effective in reducing insomnia symptoms among young adult drinkers with insomnia, regardless of cannabis use. Registry: ClinicalTrials.gov; Name: The Insomnia Treatment and Problems (iTAP) Study; URL: https://clinicaltrials.gov/ct2/show/NCT03627832; Identifier: NCT03627832. Miller MB, Carpenter RW, Freeman LK, Curtis AF, Yurasek AM, McCrae CS. Cannabis use as a moderator of cognitive behavioral therapy for insomnia.  "
9,35484520,"Little is known about cannabis use for insomnia in individuals with depression, anxiety, and comorbid depression and anxiety. To develop a better understanding of distinct profiles of cannabis use for insomnia management, a retrospective cohort study was conducted on a large naturalistic sample. Data were collected using the medicinal cannabis tracking app, Strainprint®, which allows users to monitor and track cannabis use for therapeutic purposes. The current study examined users managing insomnia symptoms in depression (n = 100), anxiety (n = 463), and comorbid depression and anxiety (n = 114), for a total of 8476 recorded sessions. Inferential analyses used linear mixed effects modeling to examine self-perceived improvement across demographic variables and cannabis product variables. Overall, cannabis was perceived to be efficacious across all groups, regardless of age and gender. Dried flower and oral oil were reported as the most used and most efficacious product forms. In the depression group, all strains were perceived to be efficacious and comparisons between strains revealed indica-dominant (M In terms of perceptions, individuals with depression, anxiety, and both conditions who use cannabis for insomnia report significant improvements in symptom severity after cannabis use. The current study highlights the need for placebo-controlled trials investigating symptom improvement and the safety of cannabinoids for sleep in individuals with mood and anxiety disorders. "
10,35459406,"The use of cannabis products to help with sleep and various other medical conditions by the public has increased significantly in recent years. Withdrawal from cannabinoids can lead to sleep disturbance. Here, we describe a patient who developed significant insomnia leading to worsening anxiety, mood, and suicidal ideation in the setting of medical cannabis withdrawal, prompting presentation to the Emergency Department and inpatient admission. There is a limited evidence base for the use of cannabis products for sleep. We provide a comprehensive review evaluating the literature on the use of cannabis products on sleep, including an overview of cannabis and related psychoactive compounds, the current state of the law as it pertains to the prescribing and use of these substances, and potential side effects and drug interactions. We specifically discuss the impact of cannabis products on normal sleep and circadian sleep-wake rhythms, insomnia, excessive daytime sleepiness, sleep apnea, parasomnias, and restless legs syndrome. We also describe the effects of cannabis withdrawal on sleep and how this increases relapse to cannabis use. Most of the studies are observational but the few published randomized controlled trials are reviewed. Our comprehensive review of the effects of cannabis products on normal sleep and sleep disorders, relevant to primary care providers and other clinicians evaluating and treating patients who use these types of products, shows that cannabis products have minimal to no effects on sleep disorders and may have deleterious effects in some individuals. Further research examining the differential impact of the various types of cannabinoids that are currently available on each of these sleep disorders is required. "
11,36107800,"As cannabis is increasingly used to treat sleep disorders, we performed a systematic review to examine the effects of cannabis on sleep and to guide cannabis prescribers in their recommendations to patients, specifically focusing on dosing. We searched EMBASE, Medline, and Web of Science and identified 4550 studies for screening. Five hundred sixty-eight studies were selected for full-text review and 31 were included for analysis. Study results were considered positive based on improvements in sleep architecture or subjective sleep quality. Bias in randomized controlled trials was assessed using Cochrane Risk of Bias tool 2.0. Sleep improvements were seen in 7 out of 19 randomized studies and in 7 out of 12 uncontrolled trials. There were no significant differences between the effects of tetrahydrocannabinol and cannabidiol. Cannabis showed most promise at improving sleep in patients with pain-related disorders, as compared to those with neurologic, psychiatric, or sleep disorders, and showed no significant effects on healthy participants' sleep. While subjective improvements in sleep quality were often observed, diagnostic testing showed no improvements in sleep architecture. Adverse events included headaches, sedation, and dizziness, and occurred more frequently at higher doses, though no serious adverse events were observed. High-quality evidence to support cannabis use for sleep remains limited. Heterogeneity in cannabis types, doses, timing of administration, and sleep outcome measures limit the ability to make specific dosing recommendations. "
12,35519083,"Medical cannabis has been increasingly used in Canada after being sanctioned by Health Canada in 2001. Insomnia and sleep disorders are among the most common conditions for which patients report using cannabis. Current research shows cannabis may have a beneficial effect in sleep disorders and may improve patient-reported sleep scores. A retrospective chart review was conducted at Hybrid Pharm community pharmacy in Ottawa, Ontario, and included patients who were interested in, or already using, medical cannabis for sleep disorders. A qualitative, exploratory approach was taken to evaluate the descriptive efficacy and safety of medical cannabis when prescribed for insomnia or comorbid conditions. The comprehensive data collection also involved investigating the impact of cannabis on other medication used for insomnia. A total of 38 patients were identified as having adequate follow-up documentation to assess the impact of medical cannabis. At time of data collection, 15 patients (39%) were able to reduce or completely discontinue a prescription medication indicated for sleep. On follow-up, 27 patients (71%) reported a subjective improvement in their sleep or related condition. Only 8 patients (21%) reported any adverse effects from medical cannabis use, and these were manageable and did not require discontinuation of cannabis. This study highlights the importance of a pharmacist's role in the management of cannabis-based therapy, including ongoing supportive care, follow-up and medication management.  "
13,36641008,
14,30907602,"Previous research has reported that sleep problems longitudinally predict both onset of cannabis use and cannabis-related problems. However, the mediators of this relationship remain unclear. The present study examined (a) the concurrent relationship between insomnia symptoms and hazardous cannabis use and (b) examined whether use of protective behavioral strategies (PBS) for cannabis mediated this relationship among college student cannabis users. Participants were 984 (69.9% female) college students who reported consuming cannabis at least once in the past month and completed measures of insomnia, cannabis PBS, and cannabis misuse. Data were analyzed by structural equation modeling for binary and count outcomes. The significance of the mediator was evaluated using bias-corrected bootstrap confidence intervals. Insomnia symptoms were associated with an increase in the odds of hazardous cannabis use and possible cannabis use disorder. Cannabis PBS significantly mediated the relationship between insomnia symptoms and hazardous cannabis use, cannabis use disorder symptoms, and cannabis-related problems. Specifically, higher reports of insomnia symptoms were associated with lower use of cannabis PBS; which in turn was associated with an increase in the odds of hazardous cannabis use and possible cannabis use disorder, as well as a higher report of cannabis-related problems. Implications of these findings on the prevention of cannabis use problems among college students in the United States were discussed. (PsycINFO Database Record (c) 2019 APA, all rights reserved). "
15,36940598,"Individuals with regular cannabis use demonstrate adverse health outcomes, yet infrequently seek treatment. Insomnia, a common co-occurring complaint, could be targeted to reduce cannabis use and improve functioning in these individuals. In an intervention development study, we refined and tested the preliminary efficacy of a telemedicine-delivered CBT for insomnia tailored to individuals with regular cannabis use for sleep (CBTi-CB-TM). In this single-blind randomized trial, fifty-seven adults (43 women, mean age 37.6 ± 12.8 years) with chronic insomnia and cannabis use for sleep ≥3 times/week received CBTi-CB-TM (n = 30) or sleep hygiene education (SHE-TM, n = 27). Participants completed self-reported assessments of insomnia (Insomnia Severity Index [ISI]) and cannabis use (Timeline Followback [TLFB] and daily diary data) at pre-treatment, post-treatment, and 8-week follow-up. ISI scores improved significantly more in the CBTi-CB-TM compared to SHE-TM condition (β = -2.83, se=0.84, P = 0.004, d=0.81). At 8-week follow-up, 18/30 (60.0 %) CBTi-CB-TM compared to 4/27 (14.8 %) SHE-TM participants were in remission from insomnia (X CBTi-CB-TM is feasible, acceptable, and demonstrated preliminary efficacy for improving sleep and cannabis-related outcomes among non-treatment-seeking individuals with regular cannabis use for sleep. Although sample characteristics limit generalizability, these findings support the need for adequately powered randomized controlled trials with longer follow-up periods. "
16,36809575,"During the treatment of cancer, 18% of patients use cannabis for symptom management. Anxiety, depression, and sleep disturbances are common symptoms in cancer. A systematic review of the evidence for cannabis use for psychological symptoms in cancer patients was undertaken to develop a guideline. A literature search of randomized trials and systematic reviews was undertaken up to November 12, 2021. Studies were independently assessed for evidence by two authors and then evaluated by all authors for approval. The literature search involved MEDLINE, CCTR, EMBASE, and PsychINFO databases. Inclusion criteria included randomized control trials and systematic reviews on cannabis versus placebo or active comparator in patients with cancer and psychological symptom management (anxiety, depression, and insomnia). The search yielded 829 articles; 145 from Medline, 419 from Embase, 62 from PsychINFO, and 203 from CCTR. Two systematic reviews and 15 randomized trials (4 on sleep, 5 on mood, 6 on both) met eligibility criteria. However, no studies specifically assessed the efficacy of cannabis on psychological symptoms as primary outcomes in cancer patients. The studies varied widely in terms of interventions, control, duration, and outcome measures. Six of 15 RCTs suggested benefits (five for sleep, one for mood). There is no high-quality evidence to recommend the use of cannabis as an intervention for psychological symptoms in patients with cancer until more high-quality research demonstrates benefit. "
17,37243415,"Insomnia is highly prevalent among military veterans, with rates nearly double that of civilian populations. Insomnia typically co-occurs with other psychological problems, including substance use (e.g. cannabis) and perceived stress. Much of the research focused on insomnia, stress and cannabis use explores cannabis as a sleep aid and a mechanism for stress relief. However, recent theoretical and empirical evidence suggests a dynamic interplay between insomnia, cannabis use and perceived stress, yet few longitudinal studies exist. Using a sample of 1105 post-9/11 veterans assessed over four time points across 12 months, we used latent difference score modelling to examine proportional change between insomnia, perceived stress and cannabis use. Results revealed a complex interplay between all three constructs. In particular, we show that higher prior levels of insomnia are associated with greater increases in perceived stress, and greater prior levels of stress are associated with greater increases in cannabis use. Perhaps more importantly, our results also point to cannabis use as a catalyst for greater increases in both stress and insomnia severity. Our results suggest there may be both benefits and costs of cannabis use among veterans. Specifically, for veterans who experience chronic sleep problems, perceived stress may become overwhelming, and the benefit of stress reduction from increased cannabis use may come at the cost of increasing insomnia symptomology. "
18,31770357,
