,PMID,abstract
55,37068366,"As greater numbers of states in the United States and countries in the world continue to legalize cannabis for medical use, it has become increasingly important to assess patterns of cannabis use in individuals using cannabis for medical symptoms over time. A public health concern is that, like recreational cannabis, some individuals using cannabis for medical reasons may develop detrimental patterns of use, leading to the development of a cannabis use disorder (CUD). In a 9-month longitudinal cohort study following a 12-week randomized, waitlist-controlled trial in 149 adults who used cannabis to alleviate insomnia, pain, depressed mood, or anxiety (RCT: NCT03224468), we assessed whether patterns of cannabis use for the 9 months following the RCT were associated with the development of CUD. We identified five unique trajectories of use; 31 participants (21%) had low stable or no use, 50 (34%) had medium stable use, 19 (13%) had high stable use, 26 (17%) showed de-escalating and 23 (15%) showed escalating use over 9 months following the RCT. Of 149 participants enrolled, 19 (13%) met diagnostic criteria for CUD at 12 months. Only the escalating cannabis use pattern predicted significantly higher rates of CUD compared to the low or no use category (OR = 4.29, 95% CI = 1.21 to 10.87, p = 0.02). These data indicate that most individuals using cannabis for medical symptoms have a stable pattern of use over the first year. Escalation of use may be a detrimental pattern that warrants further concern. "
56,38337193,"The primary aim of this study was to assess changes in sleep-specific health-related quality of life (HRQoL) for those prescribed cannabis-based medicinal products (CBMPs) for insomnia. A case series of UK patients with insomnia was analyzed. Primary outcomes were changes in the Single-Item Sleep-Quality Scale (SQS), Generalized Anxiety Disorder-7 (GAD-7), and EQ-5D-5L at up to 6 months from baseline. Statistical significance was identified as a p value < .050. 61 patients were included in the analysis. There was an improvement in the SQS from baseline at 1, 3, and 6 months (p < .001). There were also improvements in the EQ-5D-5L Index value and GAD-7 at 1, 3, and 6 months (p < .050). There were 28 (45.9%) adverse events recorded by 8 patients (13.1%). There were no life-threatening/disabling adverse events. Patients with insomnia experienced an improvement in sleep quality following the initiation of CBMPs in this medium-term analysis. Fewer than 15% of participants reported one or more adverse events. However, due to the limitations of the study design, further investigation is required before definitive conclusions can be drawn on the efficacy of CBMPs in treating insomnia. "
57,30139415,"Cannabis has been used as a medicinal plant for thousands of years. As a result of centuries of breeding and selection, there are now over 700 varieties of cannabis that contain hundreds of compounds, including cannabinoids and terpenes. Cannabinoids are fatty compounds that are the main biological active constituents of cannabis. Terpenes are volatile compounds that occur in many plants and have distinct odors. Cannabinoids exert their effect on the body by binding to receptors, specifically cannabinoid receptors types 1 and 2. These receptors, together with endogenous cannabinoids and the systems for synthesis, transport, and degradation, are called the Endocannabinoid System. The two most prevalent and commonly known cannabinoids in the cannabis plant are delta-9-tetrahydrocannabinol (THC) and cannabidiol. The speed, strength, and type of effects of cannabis vary based on the route of administration. THC is rapidly distributed through the body to fatty tissues like the brain and is metabolized by the cytochrome P450 system to 11-hydroxy-THC, which is also psychoactive. Cannabis and cannabinoids have been indicated for several medical conditions. There is evidence of efficacy in the symptomatic treatment of nausea and vomiting, pain, insomnia, post-traumatic stress disorder, anxiety, loss of appetite, Tourette's syndrome, and epilepsy. Cannabis has also been associated with treatment for glaucoma, Huntington's Disease, Parkinson's Disease, and dystonia, but there is not good evidence to support its efficacy. Side effects of cannabis include psychosis and anxiety, which can be severe. Here, we provided a summary of the history of cannabis, its pharmacology, and its medical uses. "
58,32603954,"Cannabinoids, including the two main phytocannabinoids Δ "
59,33263719,"Cannabis is increasingly being used for medicinal purposes but remains outside Western medical practice. Data on perioperative use and outcomes are scarce. Few surgeons receive training regarding legal endorsement, reported medicinal benefits, and potential risks, making it difficult to advise patients. Guidelines and additional research are needed. It is legal to recommend cannabis, which can be obtained in states with medical cannabis programs. There are many methods of consumption, oral being the safest. Activity is primarily through Δ9-tetrahydrocannabinol (THC) and cannabidiol (CBD) via cannabinoid receptors, which may be potentiated when taken together in the plant or plant extract. The known effects of cannabis on inflammation and malignancy are largely limited to laboratory experiments. However, there are higher-quality data to support adjunctive use of cannabis for relief of pain, nausea, and insomnia, which may be useful postoperatively and could potentially decrease reliance on opiates and benzodiazepines. There are prospective trials in surgical patients, but no reported data regarding surgical complications or other surgical outcomes. Currently, cannabis is regulated differently than other controlled substances, and there are issues with purity/homogeneity, making it difficult for surgeons to accept or significantly explore its medical benefits. Recommendations are made for surgeons advising patients who use cannabis based on the limited existing data. While cannabis likely has some therapeutic benefits, it must be treated as other medical controlled substances to truly elucidate its role in surgical patient care. "
60,33526110,"Growing interest in the medicinal properties of cannabis has led to an increase in its use to treat medical conditions, and the establishment of state-specific medical cannabis programs. Despite medical cannabis being legal in 33 states and the District of Colombia, there remains a paucity of data characterizing the patients accessing medical cannabis programs. We retrospectively reviewed a registry with data from 33 medical cannabis evaluation clinics in the United States, owned and operated by CB2 Insights. Data were collected primarily by face-to-face interviews for patients seeking medical cannabis certification between November 18, 2018 and March 18, 2020. Patients were removed from the analysis if they did not have a valid date of birth, were less than 18, or did not have a primary medical condition reported; a total of 61,379 patients were included in the analysis. Data were summarized using descriptive statistics expressed as a mean (standard deviation (SD)) or median (interquartile range (IQR)) as appropriate for continuous variables, and number (percent) for categorical variables. Statistical tests performed across groups included t-tests, chi-squared tests and regression. The average age of patients was 45.5, 54.8% were male and the majority were Caucasian (87.5%). Female patients were significantly older than males (47.0 compared to 44.6). Most patients reported cannabis experience prior to seeking medical certification (66.9%). The top three mutually exclusive primary medical conditions reported were unspecified chronic pain (38.8%), anxiety (13.5%) and post-traumatic stress disorder (PTSD) (8.4%). The average number of comorbid conditions reported was 2.7, of which anxiety was the most common (28.3%). Females reported significantly more comorbid conditions than males (3.1 compared to 2.3). This retrospective study highlighted the range and number of conditions for which patients in the US seek medical cannabis. Rigorous clinical trials investigating the use of medical cannabis to treat pain conditions, anxiety, insomnia, depression and PTSD would benefit a large number of patients, many of whom use medical cannabis to treat multiple conditions. "
61,34704957,"Insomnia is a prevalent condition that presents itself at both the symptom and diagnostic levels. Although insomnia is one of the main reasons individuals seek medicinal cannabis, little is known about the profile of cannabinoid use or the perceived benefit of the use of cannabinoids in daily life. We conducted a retrospective study of medicinal cannabis users to investigate the use profile and perceived efficacy of cannabinoids for the management of insomnia. Data were collected using the Strainprint app, which allows medicinal cannabis users to log conditions and symptoms, track cannabis use, and monitor symptom severity pre- and postcannabis use. Our analyses examined 991 medicinal cannabis users with insomnia across 24,189 tracked cannabis use sessions. Sessions were analyzed, and both descriptive statistics and linear mixed-effects modeling were completed to examine use patterns and perceived efficacy. Overall, cannabinoids were perceived to be efficacious across all genders and ages, and no significant differences were found among product forms, ingestion methods, or gender groups. Although all strain categories were perceived as efficacious, predominant indica strains were found to reduce insomnia symptomology more than cannabidiol (CBD) strains (estimated mean difference 0.59, SE 0.11; 95% CI 0.36-0.81; adjusted P<.001) and predominant sativa strains (estimated mean difference 0.74, SE 0.16; 95% CI 0.43-1.06; adjusted P<.001). Indica hybrid strains also presented a greater reduction in insomnia symptomology than CBD strains (mean difference 0.52, SE 0.12; 95% CI 0.29-0.74; adjusted P<.001) and predominant sativa strains (mean difference 0.67, SE 0.16; 95% CI 0.34-1.00; adjusted P=.002). Medicinal cannabis users perceive a significant improvement in insomnia with cannabinoid use, and this study suggests a possible advantage with the use of predominant indica strains compared with predominant sativa strains and exclusively CBD in this population. This study emphasizes the need for randomized placebo-controlled trials assessing the efficacy and safety profile of cannabinoids for the treatment of insomnia. "
62,31895189,"Marijuana generally refers to the dried mixture of leaves and flowers of the cannabis plant, and the term cannabis is a commonly used to refer to products derived from the Cannabis sativa L. plant. There has been an increasing interest in the potential medicinal use of cannabis to treat a variety of diseases and conditions. This review will provide the latest evidence regarding the medical risks and potential therapeutic benefits of cannabis in managing patients with sleep disorders or those with other medical conditions who commonly suffer with sleep disturbance as an associated comorbidity. Published data regarding the effects of cannabis compounds on sleep in the general population, as well as in patients with insomnia, chronic pain, posttraumatic stress disorder, and other neurological conditions, will be presented. Current trends for marijuana use and its effects on the economy and the implications that those trends and effects have on future research into medical cannabis are also presented. "
63,28457056,"A flowering plant of variegated ingredients and psychoactive qualities, cannabis has long been used for medicinal and recreational purposes. Currently, cannabis is approved in several countries for indications of symptomatic alleviation. However, limited knowledge on the benefits and risks precludes inclusion of cannabis in standard treatment guidelines. This review provides a summary of the available literature on the use of cannabis and cannabinoid-based medicines in palliative oncology. Favorable outcomes are demonstrated for chemotherapy-induced nausea and vomiting and cancer-related pain, with evidence of advantageous neurological interactions. Benefit in the treatment of anorexia, insomnia and anxiety is also suggested. Short- and long-term side effects appear to be manageable and to subside after discontinuation of the drug. Finally, cannabinoids have shown anti-neoplastic effects in preclinical studies in a wide range of cancer cells and some animal models. Further research is needed before cannabis can become a part of evidence-based oncology practice. "
64,37273764,"The primary objective of this study was to estimate the prevalence of cannabis use in patients with gynecologic malignancies and to describe patterns of cannabis use. Secondary objectives included identifying sources of cannabis information used by patients. This is a single institution cross sectional survey conducted in Calgary, Alberta. Patients with a current or prior gynecologic cancer diagnosis were considered for inclusion. Planned analysis included descriptive statistics of patient demographics, and the patterns of cannabis use were described using frequencies and proportions. Forty-six patients participated in the survey. The most common disease sites were ovarian cancer and uterine cancer, with the majority of patients receiving chemotherapy as part of their treatment (n = 35). Seventeen participants were current cannabis users (37%). The most common symptoms participants used cannabis for were pain (9/17), anxiety (9/17), and insomnia (9/17).Most patients using cannabis did not have a prescription and obtained their cannabis from a recreational dispensary (11/17). Many participants using cannabis had not talked to their doctor about cannabis (9/17). Instead, the most common sources of information about cannabis were cannabis retailers (20/46), and friends/family (20/46). Over 50% of patients would be interested in discussing cannabis if their physician broached the subject (26/46). The results from this survey indicate that patients would like to talk to their oncologist about cannabis. Further research is needed to inform physician training and direct patient education to ensure that patients have access to unbiased, evidence-based information to make decisions about cannabis use. "
65,35047242,"Many countries now allow the consumption of cannabis or cannabinoids for medical purposes with varying approaches concerning products allowed and the regulatory frameworks prevailing their endowment. On 18 February 2019 Thailand passed legislation allowing the use of cannabis for medical purposes. This study aimed to examine patterns and purposes for consumption of medical cannabis, and consumers' perceptions and opinions towards benefits and harms of cannabis and related policies in 2019-2020. A cross-sectional study using a respondent-driven sampling (RDS) method was conducted in four sites across Thailand. Participants were 485 adults aged 18 years and over, living in the study region, who had used cannabis for medical purposes within the past 12 months. Face-to-face interviews using a structured questionnaire were used to collect data on (1) demographic characteristics, (2) pattern of consumption, (3) source of information and perception of benefits and harms of medical cannabis, and (4) opinion towards cannabis policies. Data were analyzed using RDS Analyst and presented as percentage and mean with 95% confidence interval (CI). Most participants (84.7%, 95% CI [78.9-90.5]) used an oral form of crude oil extract while 9.2% (95% CI [4.1-14.2]) used the raw form. The most common uses were for treatment of cancers (23.3%, 95% CI [16.1-30.4]), neuropsychiatric symptoms (22.8%, 95% CI [17.5-28.0]), and musculoskeletal pains (21.6%, 95% CI [16.7-26.6]). Illegal sources such as underground traders (54.5%, 95% CI [40.8-68.3]), friends and relatives (12.2%, 95% CI [6.2-18.3]), not-for-profit provider groups (5.2%, 95% CI [0.5-10.9]), and clandestine growers or producers (2.9%, 95% CI [0.6-5.3]) were the main suppliers. Most (>80%) perceived cannabis could treat cancers, chronic pains, insomnia, Parkinson's disease and generalized anxiety disorder. Less than half perceived that cannabis could cause adverse conditions  Our study reports the experiences of consumers of medical cannabis in the first year after its legalization in Thailand. Consumers reported various patterns and indications of consumption that were not supported by scientific evidence, but had positive perception of the results of consumption. These findings highlight ongoing policy challenges for Thailand and can be a lesson to be learned for other countries in the region. "
66,32634714,"Poor sleep quality and insomnia have been associated with the use of tobacco, alcohol, and cannabis, but it is unclear if there is a causal link. In this Mendelian Randomization (MR) study we examine if insomnia causes substance use and/or if substance use causes insomnia. MR uses summary effect estimates from a genome-wide association study (GWAS) to create a genetic instrumental variable for a proposed 'exposure' variable and then identifies that same genetic instrument in an 'outcome' GWAS. Using GWASs of insomnia, smoking (initiation, heaviness, cessation), alcohol use (drinks per week, dependence), and cannabis initiation, bi-directional causal effects were tested. Multiple sensitivity analyses were applied to assess the robustness of the findings. There was strong evidence for positive causal effects of liability to insomnia on all substance use phenotypes (smoking traits, alcohol dependence, cannabis initiation), except alcohol per week. In the other direction, there was strong evidence that smoking initiation increased insomnia risk (smoking heaviness and cessation could not be tested as exposures). We found no evidence that alcohol use per week, alcohol dependence, or cannabis initiation causally affect insomnia risk. There were unidirectional effects of liability to insomnia on alcohol dependence and cannabis initiation, and bidirectional effects between liability to insomnia and smoking measures. Bidirectional effects between smoking and insomnia might give rise to a vicious circle. Future research should investigate if interventions aimed at insomnia are beneficial for substance use treatment. "
67,30113101,"Sleep disturbance is one of the hallmarks of cannabis withdrawal. Studies have indicated that treatment of this key symptom may facilitate abstinence. In the present paper we aim to provide a systematic review of the extant literature on pharmacological management of sleep disturbance associated with cannabis withdrawal. We conducted a systematic literature search across five electronic databases including PubMed, Psycinfo, MEDLINE, Cochrane review and Embase. Human studies using a pharmacological treatment for sleep disturbances associated with cannabis withdrawal were included. Review articles, case-series, open trials, posters, and editorials were excluded. Seventeen publications, involving 562 participants, were included in this review. Major limitations involved small sample size, high dropout rate, methodological limitations, and heterogeneity of participants. Most of the studies were at high risk of bias, further downgrading the level of evidence. A meta-analysis was not performed due to lack of quantitative data, marked heterogeneity and low quality of the included studies. There is not sufficient evidence for any of the reviewed treatment options. Methodological limitations in a majority of the studies rendered their findings preliminary. Of the twelve investigated pharmacological agents, Gabapentin, Lofexidine, Mirtazapine, Quetiapine, and Zolpidem showed some primary benefits for treatment of sleep difficulties associated with cannabis withdrawal; however, future prospective studies are required to confirm such results. This review examines the current evidence for potential pharmacological options for treatment of cannabis withdrawal and associated sleep disturbance. It furthers our knowledge and provides groundwork for future research. (Am J Addict 2018;27:453-464). "
68,35354186,"Indian hemp (lat. Cannabis sativa subs. Indica) has been used as a source of industrial fiber, seed oil, food, medicine for some somatic diseases, and it is also used as a psychoactive substance. Cannabis can be used by smoking, evaporation, as a food ingredient, or as an extract. Acute and chronic cannabis use has been shown to be detrimental to several aspects of psychological and physical health and many experimental studies done on healthy people indicate the potential of Δ9- tetra hydro cannabinoid (THC) in inducing transient, dose-dependent psychotic symptoms, but also affective, behavioral, cognitive, neurovegetative, and psychophysical symptoms. Cannabis is the most commonly used illegal drug globally. In many communities, cannabis is perceived as a low-risk drug, leading to political lobbying to decriminalize its use. The wave of laws and initiatives to liberalize cannabis use continues to spread across the United States and the rest of the world, and there seems to be a political debate in the background about the potential risks and benefits of cannabis use. Aim is to present the possible consequences that the legalization of cannabis would have from the aspect of mental health and mental disorders. Authors reviewed the literature using PubMed resources on the effects of cannabis using the keywords: cannabis use, cannabis use and psychoticism, cannabis use and depression, cannabis use and anxiety, cannabis use and cognition, cannabis use and insomnia, legalization of cannabis. Authors examined the effects of cannabis use on psychiatric disorders and the review of the legal status of cannabis use in the world was also made. The possible consequences of cannabis legalization on the public health system were also considered, based on experiences from countries where legalization has already been done. The evidence cited in this article suggests that strong claims about the need to legalize cannabis are still questionable, and may, even in the long run, remain mixed, inconclusive, or even contradictory. Political interference in this issue can trigger a wide range of unintended but profound and lasting consequences for the health system and the health of the individual. We recommend further research on this topic and data collection with an emphasis on the effects and consequences of cannabis use on mental health, and in particular the benefits and harmful effects of medical cannabis use. "
69,33439370,"The use of the cannabis plant by cancer patients has been rising significantly in the past few years worldwide, primarily driven by public demand. There is an obvious need for more reliable scientific data, pharmacology information, a better understanding of its mode of action, and available clinical evidence supporting its robust use. Physicians must complete a thorough medical assessment, screening for potential drugs, or treatment contraindications before allowing its consumption. In light of the growing popularity of cannabis usage, it is highly essential that, in the near future, the medical community will be able to provide practical recommendations and explicit guidelines, including doses, and that cannabinoid concentrations in the used products are defined regarding its prescription before any medical procedure involving its usage is authorized. Here, we review and describe the favorable outcomes demonstrating the benefits of cannabis as an adjunctive treatment to conventional medicines for chemotherapy-induced nausea, vomiting, and cancer-related pain (primarily refractory chronic or neuropathic pain). Although not yet substantial enough, the treatment of anorexia, insomnia, depression, and anxiety is also seemingly favorable. To date, reports regarding its anti-neoplastic effects or its potent immunosuppressive properties influencing response to immunotherapy are still very conflicting and controversial. Thus, with the current state of evidence, cannabis use is not advisable as initial treatment, as an adjunct or an advanced line of care. In the coming years, we expect that preclinical data and animal models will shift to the clinical arena, and more patients will be recruited for clinical trials, and their reports will advance the field. Thus, physicians should prescribe cannabis only if careful clarification and consideration is provided together with a follow-up response evaluation. "
